id,name,explanation,broader_concept,strand,source
04ec8d62-913b-4d67-a60c-caf9ecc8fe98,Polar form of a complex number,"Expressing a complex number z = x + iy as z = r(cos θ + i sin θ), where r is the modulus and θ is the argument (angle).",Complex numbers,Complex Numbers,9_Texts and tests 5- Cut down.md
3ca6500f-37a0-4fc8-90e9-c2fcd05d6dbb,Conversion between rectangular and polar forms,Using r = sqrt(x^2 + y^2) and θ = tan^(-1)(y/x) to convert between rectangular and polar forms of complex numbers.,Complex numbers,Complex Numbers,9_Texts and tests 5- Cut down.md
0c3b47a0-d657-4cf3-b636-0ae4c96e4dca,Principal value of the argument of a complex number,"The principal argument θ of a complex number is the angle measured from the positive real axis to the line segment representing the number, taken in the interval -π < θ ≤ π.",Complex numbers,Complex Numbers,9_Texts and tests 5- Cut down.md
57d955f6-71b5-4bfe-ba14-ce3af2cb63ee,Multiplication and division of complex numbers in polar form,"When multiplying complex numbers in polar form, multiply their moduli and add their arguments; when dividing, divide their moduli and subtract their arguments.",Complex numbers operations,Complex Numbers,9_Texts and tests 5- Cut down.md
542c4da9-e4b2-4885-a5ce-25cdf8bc211a,Reciprocal of a complex number in polar form,The reciprocal of z = r(cos θ + i sin θ) is (1/r)(cos(-θ) + i sin(-θ)).,Complex numbers operations,Complex Numbers,9_Texts and tests 5- Cut down.md
92bf5cda-b278-45ab-ac6e-f79527079c51,De Moivre's theorem,"For any real number θ and integer n, (cos θ + i sin θ)^n = cos nθ + i sin nθ.",Complex numbers powers,Complex Numbers,9_Texts and tests 5- Cut down.md
cf1e7ac1-61f4-48e2-aedc-2a952a5e5176,Proof of de Moivre's theorem by induction,Using mathematical induction to prove that (cos θ + i sin θ)^n = cos nθ + i sin nθ holds for all positive integers n.,Complex numbers powers,Complex Numbers,9_Texts and tests 5- Cut down.md
03fa69e8-0548-464c-aa7f-7ccf41f5b6c3,Using de Moivre's theorem to compute powers of complex numbers,"Applying de Moivre's theorem to raise complex numbers in polar form to integer powers, simplifying the expression.",Complex numbers powers,Complex Numbers,9_Texts and tests 5- Cut down.md
e21557d0-7049-46b6-bdcf-90762d7aabcd,Expressing cos nθ and sin nθ in terms of cos θ and sin θ using de Moivre's theorem,Using the binomial expansion of (cos θ + i sin θ)^n to derive formulas expressing cos nθ and sin nθ in terms of powers of cos θ and sin θ.,Trigonometric identities,Trigonometry,9_Texts and tests 5- Cut down.md
8c653b79-c87c-404e-8c22-919bc6b182ed,Finding nth roots of complex numbers using de Moivre's theorem,Expressing a complex number in polar form and applying de Moivre's theorem with fractional exponents to find all nth roots.,Complex numbers roots,Complex Numbers,9_Texts and tests 5- Cut down.md
275d8df3-62d9-40be-8cdd-bea348c9355b,Simplifying expressions of the form (cos θ - i sin θ)^n,Using the identity cos θ - i sin θ = cos(-θ) + i sin(-θ) to apply de Moivre's theorem to powers of cos θ - i sin θ.,Complex numbers powers,Complex Numbers,9_Texts and tests 5- Cut down.md
a819e0da-d9a2-4c3e-a81b-529c666d59a4,Enlargement with scale factor greater than 1,A transformation that produces a similar figure larger than the original by multiplying all distances from a fixed centre by a scale factor greater than 1.,Similarity transformations,Geometry,9_Texts and tests 5- Cut down.md
bc712973-c368-4043-ba1d-5c8261af893a,Enlargement with scale factor between 0 and 1 (reduction),A transformation that produces a similar figure smaller than the original by multiplying all distances from a fixed centre by a scale factor between 0 and 1.,Similarity transformations,Geometry,9_Texts and tests 5- Cut down.md
466e0c7b-c0ec-4fd1-897d-61abc8099a17,Finding centre of enlargement from object and image,Determining the point from which an enlargement is performed by extending lines joining corresponding points of the object and image until they intersect.,Similarity transformations,Geometry,9_Texts and tests 5- Cut down.md
02328756-044f-4f71-8f2f-80312917f692,Area scale factor in enlargements,"When a figure is enlarged by a scale factor k, the area of the image is multiplied by k^2.",Similarity transformations,Geometry,9_Texts and tests 5- Cut down.md
2ff17213-e379-4e45-893d-5a516a54df70,Construction of angle bisector,Using compass and straightedge to construct a line that divides an angle into two equal parts.,Geometric constructions,Geometry,9_Texts and tests 5- Cut down.md
6d3b8472-34d7-48c0-aaf5-8a68a042c4b3,Construction of perpendicular bisector of a line segment,Using compass and straightedge to construct a line perpendicular to a given segment that passes through its midpoint.,Geometric constructions,Geometry,9_Texts and tests 5- Cut down.md
2139eff0-09aa-447e-9572-ad5072bd0c85,Construction of circumcircle of a triangle,Constructing the circle passing through all three vertices of a triangle by finding the intersection of perpendicular bisectors of its sides.,Circle constructions,Geometry,9_Texts and tests 5- Cut down.md
1a12501b-a756-41c1-b3fc-6b2f7e0ae816,Construction of incircle of a triangle,Constructing the circle tangent to all three sides of a triangle by finding the intersection of angle bisectors and drawing a circle with radius equal to the distance from this point to a side.,Circle constructions,Geometry,9_Texts and tests 5- Cut down.md
5873e43a-ae5d-40e7-ace1-6f2829951359,Construction of centroid of a triangle,"Finding the point of concurrency of the medians of a triangle, where each median connects a vertex to the midpoint of the opposite side.",Triangle centers,Geometry,9_Texts and tests 5- Cut down.md
570cdaca-8a32-4669-ae5d-c4ccd1121f56,Construction of orthocentre of a triangle,"Finding the point of concurrency of the altitudes of a triangle, where each altitude is a perpendicular from a vertex to the opposite side.",Triangle centers,Geometry,9_Texts and tests 5- Cut down.md
1eac6a95-2c60-47e4-94b4-904fa4b85071,Antidifferentiation (indefinite integration) of power functions,"Finding the general antiderivative of functions of the form x^n, given by ∫ x^n dx = x^(n+1)/(n+1) + c, for n ≠ -1.",Integration,Calculus,9_Texts and tests 5- Cut down.md
4b0add85-081d-42c9-a693-3cfdbbf4888d,Constant of integration,An arbitrary constant c added to the indefinite integral to represent the family of antiderivatives differing by a constant.,Integration,Calculus,9_Texts and tests 5- Cut down.md
1f007cb9-f80f-4f14-94b7-730b97db4cac,Integration of sums and constant multiples,"The integral of a sum is the sum of the integrals, and constants can be factored out of the integral.",Integration,Calculus,9_Texts and tests 5- Cut down.md
6d169191-ff54-4743-8b2f-6ed7b8ee9746,Integration of exponential functions,Integrals of the form ∫ e^(ax) dx = (1/a) e^(ax) + c and ∫ a^x dx = a^x / ln a + c.,Integration,Calculus,9_Texts and tests 5- Cut down.md
c30ca31a-2475-4bf8-aa92-eef227f5f8cb,Integration of trigonometric functions,Integrals such as ∫ sin ax dx = -cos ax / a + c and ∫ cos ax dx = sin ax / a + c.,Integration,Calculus,9_Texts and tests 5- Cut down.md
7abcc839-65d6-4f97-9dd7-3a1c02c2023b,Integration by substitution (chain rule in reverse),"Integrating composite functions by recognizing the derivative of the inner function and using substitution, e.g. ∫ 6x cos 3x^2 dx = sin 3x^2 + c.",Integration,Calculus,9_Texts and tests 5- Cut down.md
a8fce78c-34c1-4229-bf2e-5271e743b2e9,"Application of integration to displacement, velocity, and acceleration",Using integration to find velocity from acceleration and displacement from velocity in motion problems.,Applications of integration,Calculus,9_Texts and tests 5- Cut down.md
7c12d73f-e52b-4272-b135-1a4af248e43a,Definite integral as area under a curve,The definite integral ∫_a^b f(x) dx represents the net area between the curve y=f(x) and the x-axis from x=a to x=b.,Integration,Calculus,9_Texts and tests 5- Cut down.md
6f482d08-348e-40b1-b274-70292b9df224,Trapezoidal rule for numerical integration,"Approximating the area under a curve by dividing it into trapezoids and summing their areas, given by (h/2)[y1 + yn + 2(y2 + ... + y_{n-1})].",Numerical integration,Calculus,9_Texts and tests 5- Cut down.md
d272cd59-e65a-4529-8e7c-c0418e638960,Average value of a function over an interval,"The average value of a continuous function f(x) over [a,b] is (1/(b-a)) ∫_a^b f(x) dx.",Applications of integration,Calculus,9_Texts and tests 5- Cut down.md
5c7e225d-50dc-4b7f-a571-a2e4ec2f8515,Rate of change as derivative,"The derivative dy/dx represents the rate of change of y with respect to x, such as velocity as rate of change of displacement.",Differential calculus,Calculus,9_Texts and tests 5- Cut down.md
8b8f4ef3-f362-4764-8b5b-17266f880337,Related rates of change using chain rule,"Finding rates of change of related variables with respect to time by applying the chain rule, e.g. dA/dt = dA/dr * dr/dt.",Applications of differentiation,Calculus,9_Texts and tests 5- Cut down.md
259eb09e-83a9-4782-94e2-92371beaf985,Compound interest formula,The amount F after t years with principal P and interest rate i compounded annually is F = P(1+i)^t.,Financial mathematics,Number,9_Texts and tests 5- Cut down.md
66a33caa-d088-4682-b998-6a9c461df5a9,Annual Equivalent Rate (AER) and monthly equivalent rate,"AER is the effective annual interest rate accounting for compounding; monthly rate r satisfies (1+r)^12 = 1 + i, where i is the annual rate.",Financial mathematics,Number,9_Texts and tests 5- Cut down.md
8ce95f1c-f568-4743-a718-2c0d1c6d8bf1,Present value of a sum,The present value of a future amount F due in t years at interest rate i is P = F / (1+i)^t.,Financial mathematics,Number,9_Texts and tests 5- Cut down.md
531832e8-7dd3-4421-a27a-e233bf3124b4,Reducing balance depreciation formula,"Depreciation where the value decreases by a fixed percentage i each year, given by F = P(1 - i)^t.",Financial mathematics,Number,9_Texts and tests 5- Cut down.md
cfe010e8-c48b-4d23-b7d8-0530a0db9a19,Instalment savings (annuity) final value formula,The accumulated value of regular payments P made at the start of each period for t periods at interest rate i is F = P(1+i) * ((1+i)^t - 1) / i.,Financial mathematics,Number,9_Texts and tests 5- Cut down.md
c696cff8-2b67-4e9c-8a2f-96d4474a95d9,Present value of a pension (annuity),The present value of t payments of P each at interest rate i is PV = (P / (1+i)) * (1 - (1+i)^(-t)) / (1 - 1/(1+i)).,Financial mathematics,Number,9_Texts and tests 5- Cut down.md
3060eb27-b888-4a36-bbc8-e5597ea728de,Loan repayment (mortgage) formula,Monthly repayment A for loan P over t months at monthly interest rate i is A = P * (i(1+i)^t) / ((1+i)^t - 1).,Financial mathematics,Number,9_Texts and tests 5- Cut down.md
92c1d69e-f58d-4ac9-bd7f-ff68ac37a75c,Tree diagram for probability,"A graphical representation of all possible outcomes of sequential events, with branches showing outcomes and their probabilities.",Probability,Probability,9_Texts and tests 5- Cut down.md
e870ed3a-cefd-4db6-a842-32fe4ee64cc8,Probability of independent events,"For independent events A and B, the probability of both occurring is P(A ∩ B) = P(A) × P(B).",Probability,Probability,9_Texts and tests 5- Cut down.md
dc9d30f1-8f72-4c83-a62f-20d2ddb6a396,Probability of events without replacement,Calculating probabilities when outcomes affect subsequent events due to removal of items from the sample space.,Probability,Probability,9_Texts and tests 5- Cut down.md
47d15390-faee-49fb-88d5-96cc558ef476,Probability distribution of a discrete random variable,A list or function that assigns probabilities to each possible value of a discrete random variable.,Probability,Probability,9_Texts and tests 5- Cut down.md
8821ff27-7635-4f2f-9266-641a2d1bb317,Expected value of a discrete random variable,"The weighted average of all possible values of a discrete random variable, calculated as Σ x P(x).",Probability,Probability,9_Texts and tests 5- Cut down.md
ec063e99-d8db-49af-9893-966e9b176293,Fair game and expected value,"A game is fair if the expected value of the net gain or loss is zero; positive expected value favors the player, negative favors the house.",Probability,Probability,9_Texts and tests 5- Cut down.md
450b5f10-6d8b-4a3c-83bd-cdd43cc2de96,Bernoulli trials,A sequence of independent trials each with two possible outcomes (success/failure) and constant probability of success.,Probability,Probability,9_Texts and tests 5- Cut down.md
eec1aa9b-74cc-4fa3-8c80-822ec2d61777,Binomial distribution probability formula,"Probability of exactly r successes in n Bernoulli trials is P(r) = C(n,r) p^r (1-p)^{n-r}.",Probability distributions,Probability,9_Texts and tests 5- Cut down.md
ae946e62-26ab-4698-863e-59f761f77c76,Probability of kth success on nth trial,"Probability that the kth success occurs on the nth trial in Bernoulli trials is C(n-1,k-1) p^k (1-p)^{n-k}.",Probability distributions,Probability,9_Texts and tests 5- Cut down.md
ca596444-dc02-4a0e-b367-dc121f1ccee5,Testing independence of events using multiplication rule,Two events A and B are independent if and only if P(A ∩ B) = P(A) × P(B).,Probability,Probability,9_Texts and tests 5- Cut down.md
b28aa524-90b4-47b7-9d29-73324d7a5cb1,Use of permutations and combinations in probability,Applying counting techniques to determine the number of possible outcomes or favorable outcomes in probability problems.,Counting methods in probability,Probability,9_Texts and tests 5- Cut down.md
8f3ecc80-241f-4739-9c04-22e888adab66,Probability of at least one event occurring,The probability that an event occurs at least once is 1 - P(event does not occur).,Probability,Probability,9_Texts and tests 5- Cut down.md
63827bc4-e932-45d9-b56e-d34f11586fa8,Probability simulation,Using random experiments or computational methods to model and estimate probabilities of complex events.,Probability,Probability,9_Texts and tests 5- Cut down.md
d448c7f9-2c09-4b21-8e5e-eddc73853bf8,Function as a relation with unique output for each input,A function is a relation where each element of the domain corresponds to exactly one element of the range.,Functions,Algebra,9_Texts and tests 5- Cut down.md
4f26a957-cb89-4679-bf1a-5150dda5fc78,"Domain, codomain, and range of a function","Domain is the set of inputs, codomain is the set of possible outputs, and range is the set of actual outputs of a function.",Functions,Algebra,9_Texts and tests 5- Cut down.md
a7154c36-b999-4438-b1c0-a2cc2fd451d3,Vertical line test for functions,A graph represents a function if and only if no vertical line intersects the graph more than once.,Functions,Algebra,9_Texts and tests 5- Cut down.md
e97daa0b-2a0d-4567-a680-de9429f8bdee,Injective (one-to-one) function,A function where each element of the codomain is mapped to by at most one element of the domain.,Functions,Algebra,9_Texts and tests 5- Cut down.md
99a4a35d-3f0d-4d11-a674-35fd1889296e,Surjective (onto) function,A function where every element of the codomain is the image of at least one element of the domain.,Functions,Algebra,9_Texts and tests 5- Cut down.md
7f27ac74-2ef7-459a-bf7f-13c29900a78a,Bijective function,"A function that is both injective and surjective, establishing a one-to-one correspondence between domain and codomain.",Functions,Algebra,9_Texts and tests 5- Cut down.md
c691e9b4-2f53-4f6a-9183-4c12abcf64fc,Inverse function,"A function f^{-1} that reverses the mapping of a bijective function f, satisfying f^{-1}(f(x)) = x and f(f^{-1}(x)) = x.",Functions,Algebra,9_Texts and tests 5- Cut down.md
3cdbd1bf-0f2f-4f38-be96-458991b40b63,Finding inverse functions algebraically,Solving y = f(x) for x in terms of y and then interchanging variables to find f^{-1}(x).,Functions,Algebra,9_Texts and tests 5- Cut down.md
8a3410bd-6552-46e9-91b3-ae549de5bccb,Restricted domain for invertibility,Limiting the domain of a non-bijective function to make it bijective and thus invertible.,Functions,Algebra,9_Texts and tests 5- Cut down.md
918ba212-a8f5-4362-bb4c-442d7bb80d12,"Sketching graphs of linear, quadratic, and cubic functions",Plotting key points such as intercepts and turning points to draw approximate graphs of polynomial functions.,Graphing functions,Algebra,9_Texts and tests 5- Cut down.md
587de9ff-bb36-40c5-b78c-23e99f8d1569,Completed square form of quadratic functions,Rewriting a quadratic function in the form a(x-h)^2 + k to identify vertex and graph shape.,Quadratic functions,Algebra,9_Texts and tests 5- Cut down.md
50d0b80d-c782-4c01-87a1-3908d066e9d0,Transformation of functions: translations and reflections,"Shifting graphs vertically or horizontally and reflecting them about axes using function modifications like f(x) ± a, f(x ± a), -f(x), and f(-x).",Function transformations,Algebra,9_Texts and tests 5- Cut down.md
69730718-8bf2-46fd-9382-f19dff3fee13,Stretching and compressing graphs vertically,Multiplying a function by a constant a to stretch (|a|>1) or compress (|a|<1) the graph vertically.,Function transformations,Algebra,9_Texts and tests 5- Cut down.md
dc078654-444c-4889-b1ec-b75181996a11,Exponential functions and their graphs,"Functions of the form f(x) = a^x where a>0, a ≠ 1, with graphs showing exponential growth for a>1 and decay for 0<a<1.",Exponential and logarithmic functions,Algebra,9_Texts and tests 5- Cut down.md
b9bad937-15ac-4f1e-847b-16d5ddead61c,Logarithmic functions and their graphs,"Inverse functions of exponential functions, defined as f(x) = log_a x, with domain x>0 and range all real numbers.",Exponential and logarithmic functions,Algebra,9_Texts and tests 5- Cut down.md
6fe12afa-07f2-4894-befd-fee7bca975af,Standard normal distribution and Z-scores,A normal distribution with mean 0 and standard deviation 1; Z-scores represent the number of standard deviations a value is from the mean.,Probability distributions,Statistics,9_Texts and tests 5- Cut down.md
e6274bb7-2096-4cf7-b4ee-4f4d1f9d6f39,Empirical Rule for normal distributions,"Approximately 68% of data lie within 1 standard deviation, 95% within 2, and 99.7% within 3 standard deviations of the mean in a normal distribution.",Probability distributions,Statistics,9_Texts and tests 5- Cut down.md
cca84ac7-60a5-4be5-bc40-627076087451,Correlation coefficient,A numerical measure r between -1 and 1 indicating the strength and direction of a linear relationship between two variables.,Correlation and regression,Statistics,9_Texts and tests 5- Cut down.md
7cf2cc48-676a-4b71-94ed-ba989721d82f,Line of best fit (linear regression),"A straight line drawn through a scatter plot that best represents the trend of the data, minimizing the sum of squared residuals.",Correlation and regression,Statistics,9_Texts and tests 5- Cut down.md
2c86b0b6-642b-4a51-a8c0-22c8e13accd4,Confidence interval for population proportion using margin of error approximation,An interval estimate for a population proportion p given by p̂ ± 1/√n at 95% confidence level.,Statistical inference,Statistics,9_Texts and tests 5- Cut down.md
3e722023-6d1d-4a00-9735-9cd67bae66c1,Confidence interval for population proportion using standard error,An interval estimate for a population proportion p given by p̂ ± 1.96 sqrt(p̂(1-p̂)/n) at 95% confidence level.,Statistical inference,Statistics,9_Texts and tests 5- Cut down.md
fd5ac754-3917-4127-9101-cbb174b51e29,Hypothesis testing for population proportion,Testing a claim about a population proportion p by comparing the sample proportion p̂ and confidence interval or p-value at a chosen significance level.,Statistical inference,Statistics,9_Texts and tests 5- Cut down.md
ec17c9e3-5c9e-44b2-8ead-ccbb3b1a00ef,Sampling distribution of the mean,The probability distribution of sample means x̄ from samples of size n drawn from a population.,Statistical inference,Statistics,9_Texts and tests 5- Cut down.md
34940763-7f30-4d4c-9369-34650ae68d08,Central Limit Theorem,"For sufficiently large n, the sampling distribution of the mean x̄ is approximately normal regardless of the population distribution, with mean μ and standard error σ/√n.",Statistical inference,Statistics,9_Texts and tests 5- Cut down.md
20bd9653-d3d9-43a1-bdd2-c9cf1ddb7952,Confidence interval for population mean with known standard deviation,An interval estimate for population mean μ given by x̄ ± 1.96 (σ/√n) at 95% confidence level.,Statistical inference,Statistics,9_Texts and tests 5- Cut down.md
eb8eee53-7a18-42ee-9fda-2767292f218a,Hypothesis testing for population mean,Testing a claim about a population mean μ by calculating a test statistic z = (x̄ - μ) / (σ/√n) and comparing with critical values or p-value at a significance level.,Statistical inference,Statistics,9_Texts and tests 5- Cut down.md
97987f38-3bf7-4831-b94f-ef2692380995,p-value in hypothesis testing,"The probability of observing a test statistic as extreme as, or more extreme than, the observed value under the null hypothesis; used to decide whether to reject the null hypothesis.",Statistical inference,Statistics,9_Texts and tests 5- Cut down.md
7ef62c4e-6160-4b20-ac74-8ab7c25b7c0d,Construction of Altitudes (Perpendiculars from Vertices),Concept referenced in relationship: Construction of Altitudes (Perpendiculars from Vertices),Unknown,Unknown,9_Texts and tests 5- Cut down.md
e46cf94b-c9d4-4bf0-bee3-b12fd6b694d6,Integration of Exponential and Trigonometric Functions,Concept referenced in relationship: Integration of Exponential and Trigonometric Functions,Unknown,Unknown,9_Texts and tests 5- Cut down.md
b60c48b5-d7f5-42de-a684-682260f63b0c,Applications of Integration,Concept referenced in relationship: Applications of Integration,Unknown,Unknown,9_Texts and tests 5- Cut down.md
075ac30a-bdd8-434d-b718-350e090ecae2,Definite Integrals,Concept referenced in relationship: Definite Integrals,Unknown,Unknown,9_Texts and tests 5- Cut down.md
99fc15d9-88a7-4120-be99-a05008cd7fd4,Finding Areas by Integration,Concept referenced in relationship: Finding Areas by Integration,Unknown,Unknown,9_Texts and tests 5- Cut down.md
e280c488-178a-4269-b1dd-1ce95d98b0ea,"Applications of Differential Calculus (Tangents, Stationary Points, Max/Min)","Concept referenced in relationship: Applications of Differential Calculus (Tangents, Stationary Points, Max/Min)",Unknown,Unknown,9_Texts and tests 5- Cut down.md
ec7c4708-8f99-4b05-aa8b-5e8b14b1282d,Instalment Savings (Annuities) Final Value Formula,Concept referenced in relationship: Instalment Savings (Annuities) Final Value Formula,Unknown,Unknown,9_Texts and tests 5- Cut down.md
c04ade94-30da-4a3f-b2ac-e0bfc5c25dd6,Probability Involving Permutations and Combinations,Concept referenced in relationship: Probability Involving Permutations and Combinations,Unknown,Unknown,9_Texts and tests 5- Cut down.md
b7bf54a4-e3e6-496b-9253-3a4920ec0797,Tree Diagrams,Concept referenced in relationship: Tree Diagrams,Unknown,Unknown,9_Texts and tests 5- Cut down.md
a1f85b64-5d18-4a4b-86c9-5415500e5861,Probability Distributions and Expected Value,Concept referenced in relationship: Probability Distributions and Expected Value,Unknown,Unknown,9_Texts and tests 5- Cut down.md
8414a597-2a69-409e-a99b-c7ca58d01eff,Probability Basics,Concept referenced in relationship: Probability Basics,Unknown,Unknown,9_Texts and tests 5- Cut down.md
6cc0c233-2b9e-4981-87b1-8bba9971403d,How to Show Events are Independent,Concept referenced in relationship: How to Show Events are Independent,Unknown,Unknown,9_Texts and tests 5- Cut down.md
22516e71-bcbd-4d49-9a92-3c1539ae6e0b,Composition of Functions,Concept referenced in relationship: Composition of Functions,Unknown,Unknown,9_Texts and tests 5- Cut down.md
87053098-fa53-4f69-99e2-ee400abe1cab,"Types of Functions (Injective, Surjective, Bijective)","Concept referenced in relationship: Types of Functions (Injective, Surjective, Bijective)",Unknown,Unknown,9_Texts and tests 5- Cut down.md
0e1b041f-1cf0-4028-bdeb-e1323744eb9d,Functions and Graphs,Concept referenced in relationship: Functions and Graphs,Unknown,Unknown,9_Texts and tests 5- Cut down.md
afef5a7f-dfd4-4efa-bb03-096b98c5b369,Sketching Graphs of Functions,Concept referenced in relationship: Sketching Graphs of Functions,Unknown,Unknown,9_Texts and tests 5- Cut down.md
d3e2862e-edab-4ec5-809e-55b4e965daf2,Exponential and Logarithmic Functions,Concept referenced in relationship: Exponential and Logarithmic Functions,Unknown,Unknown,9_Texts and tests 5- Cut down.md
695480b2-502e-43fe-a142-44aa42c47ecd,Related Graphs (Transformations),Concept referenced in relationship: Related Graphs (Transformations),Unknown,Unknown,9_Texts and tests 5- Cut down.md
8824b61c-52eb-4acb-8532-7e5397137de1,Scatter Diagrams,Concept referenced in relationship: Scatter Diagrams,Unknown,Unknown,9_Texts and tests 5- Cut down.md
5f084367-6264-46da-ab6b-f6b4bfe907b3,Measuring Correlation - Line of Best Fit,Concept referenced in relationship: Measuring Correlation - Line of Best Fit,Unknown,Unknown,9_Texts and tests 5- Cut down.md
72630ec7-c183-4862-91de-a2fde7d24352,Standard Scores (z-scores),Concept referenced in relationship: Standard Scores (z-scores),Unknown,Unknown,9_Texts and tests 5- Cut down.md
58792315-fb5a-420b-9a54-4f2a77d271df,Normal Probability Distributions,Concept referenced in relationship: Normal Probability Distributions,Unknown,Unknown,9_Texts and tests 5- Cut down.md
14eaf39c-f7cc-4e4a-8382-274da52abbac,Linear Function Representation,"A linear function is represented in the form ax + b, where a and b are constants, and x is the variable. It describes a straight line when graphed.",Functions,Algebra,2_Curriculum csvs - Functions.csv
563c81a2-be74-427c-aab8-f2c218c5fdb2,Composite Functions,"Composite functions are formed by applying one function to the result of another function, denoted as (f ∘ g)(x) = f(g(x)).",Functions,Algebra,2_Curriculum csvs - Functions.csv
