id,name,explanation,broader_concept,strand,source
d7c6ff7d-35ac-40c3-b151-216c42e20cc8,Quadratic Function Representation,"A quadratic function is expressed in the form ax² + bx + c, where a, b, and c are constants. It represents a parabola when graphed.",Functions,Algebra,2_Curriculum csvs - Functions.csv
adf103ab-cbe6-4c85-9554-555d8bb14d31,Cubic Function Representation,"A cubic function is represented in the form ax³ + bx² + cx + d, where a, b, c, and d are constants. It describes a curve with possible inflection points when graphed.",Functions,Algebra,2_Curriculum csvs - Functions.csv
3d52c858-f50f-4792-829c-04c5ed18f1bc,Exponential Function Representation,"An exponential function is expressed in the form ab^x, where a is a constant and b is the base raised to the power of x. It models growth or decay processes.",Functions,Algebra,2_Curriculum csvs - Functions.csv
b2e1eaf3-e43e-4a8f-9a4c-d1336c3ef446,Logarithmic Function Representation,"A logarithmic function is expressed in the form f(x) = log_b(x), where b is the base. It is the inverse of the exponential function.",Functions,Algebra,2_Curriculum csvs - Functions.csv
eeb7d359-b71f-46f5-a669-c5f04172a94a,Trigonometric Function Representation,"Trigonometric functions include sine, cosine, and tangent, which relate angles to the ratios of sides in right triangles. They are periodic functions.",Functions,Trigonometry,2_Curriculum csvs - Functions.csv
ebaba106-590c-42cd-9d56-6a627b5bec5a,Surjective Function,A surjective function is one where every element in the codomain has at least one pre-image in the domain. It is also known as an onto function.,Functions,Algebra,2_Curriculum csvs - Functions.csv
859832a2-ccce-45d6-b978-53db3b6753da,Injective Function,"An injective function is one where each element in the domain maps to a unique element in the codomain, meaning no two different inputs have the same output.",Functions,Algebra,2_Curriculum csvs - Functions.csv
548bef14-be3e-4542-8546-8d217b5931ed,Complete Square Form of Quadratic Function,"The complete square form of a quadratic function expresses it as a perfect square trinomial, facilitating the identification of roots and vertex.",Quadratic Functions,Algebra,2_Curriculum csvs - Functions.csv
fb672399-e9e4-4a01-b0b8-7c1f564d9b0b,Roots of Quadratic Function,"The roots of a quadratic function are the values of x for which the function equals zero, found using factoring, completing the square, or the quadratic formula.",Quadratic Functions,Algebra,2_Curriculum csvs - Functions.csv
08ed727d-b289-473e-a219-e0b2a4b3385c,Turning Points of Quadratic Function,"Turning points of a quadratic function are the maximum or minimum points on its graph, determined from the vertex of the parabola.",Quadratic Functions,Algebra,2_Curriculum csvs - Functions.csv
c17df3a4-d3ee-4ae5-bec1-bfee0efb9545,First Derivative,The first derivative of a function represents the rate of change or the slope of the tangent line at any point on the graph of the function.,Calculus,Calculus,2_Curriculum csvs - Functions.csv
2c2ced70-82f8-4f84-8280-c7ab99d7aaa3,Differentiation of Polynomial Functions,Differentiation of polynomial functions involves applying rules to find the derivative of functions expressed as sums of powers of x.,Differentiation,Calculus,2_Curriculum csvs - Functions.csv
bf07eb6a-7eef-4eb6-9b7a-a93c59488416,Differentiation of Trigonometric Functions,"Differentiation of trigonometric functions involves finding the derivatives of sine, cosine, and other trigonometric functions.",Differentiation,Calculus,2_Curriculum csvs - Functions.csv
ceccaaee-addc-4717-994e-33b06ec2222b,Differentiation of Rational Powers,Differentiation of rational powers involves finding the derivative of functions expressed as x raised to a rational exponent.,Differentiation,Calculus,2_Curriculum csvs - Functions.csv
2585323b-df6d-43d3-bd96-fb9458cd5979,Differentiation of Inverse Functions,Differentiation of inverse functions involves applying the inverse function theorem to find the derivative of functions that are inverses of others.,Differentiation,Calculus,2_Curriculum csvs - Functions.csv
9bfff2d5-3656-49a1-89f4-03fde9c7ebbc,Integration as Reverse Process of Differentiation,"Integration is the process of finding the antiderivative of a function, effectively reversing the operation of differentiation.",Integration,Calculus,2_Curriculum csvs - Functions.csv
5396cf67-4a50-46cb-b1bd-53b0e0bbc4bc,Area Under Polynomial Curve,"The area under a polynomial curve can be determined using definite integrals, representing the accumulation of values of the polynomial function.",Area Calculation,Calculus,2_Curriculum csvs - Functions.csv
e9100a74-b8c9-438d-9a3f-2b92fed37453,Area Under Exponential Curve,"The area under an exponential curve can be found using definite integrals, representing the total accumulation of the exponential function's values.",Area Calculation,Calculus,2_Curriculum csvs - Functions.csv
1b088238-0d3a-4e5a-9d89-015af5ae2763,Functions as a special type of relationship,Concept referenced in relationship: Functions as a special type of relationship,Unknown,Unknown,2_Curriculum csvs - Functions.csv
7068cde0-c88d-4c8f-b630-d9f99cc14ecd,recognise that a function assigns a unique output to a given input,Concept referenced in relationship: recognise that a function assigns a unique output to a given input,Unknown,Unknown,2_Curriculum csvs - Functions.csv
479f3efd-0b05-4f63-8454-b020cbc97f85,"graph functions of the form ax+b where a,b ∈ Q, x ∈ R","Concept referenced in relationship: graph functions of the form ax+b where a,b ∈ Q, x ∈ R",Unknown,Unknown,2_Curriculum csvs - Functions.csv
a4296773-aa34-483a-a301-a5f163401bab,"graph functions of the form ax2+bx+c where a,b,c ∈ Q, x ∈ R","Concept referenced in relationship: graph functions of the form ax2+bx+c where a,b,c ∈ Q, x ∈ R",Unknown,Unknown,2_Curriculum csvs - Functions.csv
fcb1fd54-cd5f-4979-9061-a4be1fec0489,express quadratic functions in complete square form,Concept referenced in relationship: express quadratic functions in complete square form,Unknown,Unknown,2_Curriculum csvs - Functions.csv
74d6aa41-a23d-4cda-b7ec-bc3f4ba58418,differentiate linear and quadratic functions from first principles,Concept referenced in relationship: differentiate linear and quadratic functions from first principles,Unknown,Unknown,2_Curriculum csvs - Calculus.csv
d50187e4-61c8-417c-bdd3-cead69f58691,recognise integration as the reverse process of differentiation,Concept referenced in relationship: recognise integration as the reverse process of differentiation,Unknown,Unknown,2_Curriculum csvs - Calculus.csv
3fadf633-9cd3-42eb-be90-039a29d0bab2,Generating Arithmetic Expressions from Patterns,"The process of creating arithmetic expressions based on identified repeating patterns, involving inputs and outputs.",Patterns and Relationships,Algebra,3_Curriculum csvs - Algebra.csv
42378122-8772-4197-b466-d5c46590db75,Representing Linear Patterns with Tables,Using tables to visually represent and analyze linear patterns and relationships in data.,Data Representation,Algebra,3_Curriculum csvs - Algebra.csv
afdcff95-f3f1-4848-9246-54af03abb090,Representing Linear Patterns with Diagrams,Utilizing diagrams to illustrate and interpret linear patterns and relationships.,Data Representation,Algebra,3_Curriculum csvs - Algebra.csv
2c63cb47-e803-45f7-8b1e-2722f422b7e2,Representing Linear Patterns with Graphs,Employing graphs to visualize and analyze linear patterns and relationships.,Data Representation,Algebra,3_Curriculum csvs - Algebra.csv
369251f9-4666-457c-ae40-148b15664a8c,Finding Underlying Formulae for Linear Relationships,Identifying the general formula that describes a linear relationship based on observed data.,Algebraic Relationships,Algebra,3_Curriculum csvs - Algebra.csv
51ab1497-7de1-47d1-b0a0-31deba369963,Examining Features of Linear Relationships,"Analyzing characteristics of linear relationships, such as rate of change and y-intercept, across different representations.",Algebraic Relationships,Algebra,3_Curriculum csvs - Algebra.csv
9f2551c8-b910-4ed2-b1f4-1f42e083fdfb,Identifying Proportional Relationships,Recognizing and understanding relationships where one quantity is directly proportional to another.,Proportional Relationships,Algebra,3_Curriculum csvs - Algebra.csv
78f1e19b-aae2-4387-8bc5-b944bc9c4361,Using Graphs to Represent Motion,Exploring and interpreting graphs that depict motion and the quantitative relationships involved.,Graphical Representation,Algebra,3_Curriculum csvs - Algebra.csv
84941832-09d9-4530-8707-2e8849b7c0ca,Evaluating Expressions,Calculating the value of algebraic expressions by substituting in the values of the variables.,Algebraic Operations,Algebra,3_Curriculum csvs - Algebra.csv
37e196a9-1fb5-4548-9f8f-08a71bfda9f4,Expanding Expressions,The process of multiplying out expressions to eliminate parentheses and combine like terms.,Algebraic Operations,Algebra,3_Curriculum csvs - Algebra.csv
91dc0205-ba5f-41cb-b05a-bec7639168ce,Re-grouping Expressions,Rearranging the terms of an expression to facilitate simplification or evaluation.,Algebraic Operations,Algebra,3_Curriculum csvs - Algebra.csv
e30f0016-2d93-49e6-8c0b-ec8e7b65ef60,Factorising Quadratic Expressions,The process of breaking down a quadratic expression into its factors.,Algebraic Operations,Algebra,3_Curriculum csvs - Algebra.csv
6f65c732-445a-47ad-bbf4-6cac8dacb2bd,Adding and Subtracting Polynomial Expressions,Performing addition and subtraction operations on polynomial expressions while considering like terms.,Algebraic Operations,Algebra,3_Curriculum csvs - Algebra.csv
1f8c9b19-47c2-47fa-a3cc-e5f935656bb2,Using Associative Property,Applying the associative property to group terms in expressions for simplification.,Properties of Operations,Algebra,3_Curriculum csvs - Algebra.csv
0c6f36ee-c167-4e96-8471-c577e7680f5a,Using Distributive Property,Applying the distributive property to multiply a single term by a sum or difference within parentheses.,Properties of Operations,Algebra,3_Curriculum csvs - Algebra.csv
f864d8d2-3a49-4404-8343-9258e87dff10,Rearranging Formulae,The process of manipulating an equation to isolate a specific variable.,Algebraic Manipulation,Algebra,3_Curriculum csvs - Algebra.csv
1241075e-ad21-4c58-b633-a4095d291c29,Solving Linear Inequalities,Finding the values of variables that satisfy a linear inequality set in context.,Inequalities,Algebra,3_Curriculum csvs - Algebra.csv
bcd51e07-5b82-4c6a-85c1-e7aeef36333c,Using the Factor Theorem,Applying the Factor Theorem to determine the factors of polynomials.,Polynomial Theory,Algebra,3_Curriculum csvs - Algebra.csv
2f570903-0e5c-4c4a-8cb3-2fc1c1d81e58,Working with Complex Numbers in Rectangular Form,Performing operations with complex numbers expressed in rectangular form (a + bi).,Complex Numbers,Algebra,3_Curriculum csvs - Algebra.csv
9e27474f-1b3b-466b-a74d-f7bec8960d35,Working with Complex Numbers in Polar Form,Performing operations with complex numbers expressed in polar form (r(cos θ + i sin θ)).,Complex Numbers,Algebra,3_Curriculum csvs - Algebra.csv
b6286738-435c-4b89-b702-5e02141d637b,Using De Moivre’s Theorem,Applying De Moivre’s Theorem to simplify expressions involving powers of complex numbers.,Complex Numbers,Algebra,3_Curriculum csvs - Algebra.csv
eb51db04-6d54-4a1a-bece-3013f10b0aed,Proving De Moivre’s Theorem by Induction,Using mathematical induction to prove the validity of De Moivre’s Theorem for natural numbers.,Complex Numbers,Algebra,3_Curriculum csvs - Algebra.csv
5e02213f-1399-463e-b9be-b0d9a1d572b2,Generating arithmetic expressions from repeating patterns,Concept referenced in relationship: Generating arithmetic expressions from repeating patterns,Unknown,Unknown,3_Curriculum csvs - Algebra.csv
22975163-19fc-48fa-a305-940c872175f9,Finding formulae,Concept referenced in relationship: Finding formulae,Unknown,Unknown,3_Curriculum csvs - Algebra.csv
dec1e02d-5fb7-4e11-8e50-531ec717f6f9,"Representing situations with tables, diagrams and graphs","Concept referenced in relationship: Representing situations with tables, diagrams and graphs",Unknown,Unknown,3_Curriculum csvs - Algebra.csv
ff5b7d43-0973-4b07-9aca-1e9b17e0b01f,Examining algebraic relationships,Concept referenced in relationship: Examining algebraic relationships,Unknown,Unknown,3_Curriculum csvs - Algebra.csv
18de53e6-8fec-47fb-b3b2-e818c9339d14,Solving inequalities,Concept referenced in relationship: Solving inequalities,Unknown,Unknown,3_Curriculum csvs - Algebra.csv
8ed89f42-4ba1-4b84-9bd9-bef41f73bfe8,Set Membership of a Line,"The definition that specifies when a line passes through a given point, establishing the relationship between points and lines.",Geometric Definitions,Geometry,6_Leaving Cert Maths-Geometry_Detail.pdf
9ecd1828-0c12-4b76-8b20-e66eae95279a,Collinear Points,Three or more points are said to be collinear if they lie on the same straight line.,Point Relationships,Geometry,6_Leaving Cert Maths-Geometry_Detail.pdf
6005017a-3477-4640-9b93-e3532e05b9ae,Angle Definition,An angle is formed by two rays that share a common endpoint called the vertex.,Angle Properties,Geometry,6_Leaving Cert Maths-Geometry_Detail.pdf
e0aa9927-784f-4b50-8647-7a2bfc2ef7ca,Acute Angle,An angle that measures less than 90 degrees.,Types of Angles,Geometry,6_Leaving Cert Maths-Geometry_Detail.pdf
337aa5dc-10a3-4f65-998e-ac667be921c8,Obtuse Angle,An angle that measures more than 90 degrees but less than 180 degrees.,Types of Angles,Geometry,6_Leaving Cert Maths-Geometry_Detail.pdf
28fd39a6-70ee-437b-b892-9b0093f37368,Right Angle,An angle that measures exactly 90 degrees.,Types of Angles,Geometry,6_Leaving Cert Maths-Geometry_Detail.pdf
2b015a4a-49b3-49f1-abf2-6d186da9b979,Straight Angle,An angle that measures exactly 180 degrees.,Types of Angles,Geometry,6_Leaving Cert Maths-Geometry_Detail.pdf
dc5363ab-2d24-4d1a-95d1-6b277c4ea3d7,Reflex Angle,An angle that measures more than 180 degrees but less than 360 degrees.,Types of Angles,Geometry,6_Leaving Cert Maths-Geometry_Detail.pdf
b05f468a-3d57-4232-bc29-06ebbbf9879d,Angle Bisector,A ray that divides an angle into two equal angles.,Angle Properties,Geometry,6_Leaving Cert Maths-Geometry_Detail.pdf
927d27dd-45c9-475a-9019-ce8c16bc5379,Supplementary Angles,Two angles whose measures add up to 180 degrees.,Angle Relationships,Geometry,6_Leaving Cert Maths-Geometry_Detail.pdf
7a33370e-e335-474d-8f6d-28ddc43f3c50,Vertically Opposite Angles,"Angles that are opposite each other when two lines cross, and they are equal in measure.",Angle Relationships,Geometry,6_Leaving Cert Maths-Geometry_Detail.pdf
1b7de53b-7d63-419e-8517-82e972d33c39,Congruent Triangles,"Triangles that are identical in shape and size, having equal corresponding sides and angles.",Triangle Properties,Geometry,6_Leaving Cert Maths-Geometry_Detail.pdf
37036995-1bb3-488c-a818-97078eba68b2,Isosceles Triangle,A triangle with at least two sides of equal length.,Types of Triangles,Geometry,6_Leaving Cert Maths-Geometry_Detail.pdf
f644f5bc-5472-4383-a858-c190bccb7691,Equilateral Triangle,A triangle where all three sides are of equal length.,Types of Triangles,Geometry,6_Leaving Cert Maths-Geometry_Detail.pdf
ea5273c0-b046-4eda-aeb5-e415e2f12831,Scalene Triangle,A triangle with all sides of different lengths.,Types of Triangles,Geometry,6_Leaving Cert Maths-Geometry_Detail.pdf
03616dfd-10a6-42d1-90af-72749e81f4aa,Right-Angled Triangle,A triangle that has one angle measuring exactly 90 degrees.,Types of Triangles,Geometry,6_Leaving Cert Maths-Geometry_Detail.pdf
ebc11944-3725-4980-900b-b89b5afaaded,Triangle Inequality Theorem,The theorem stating that the sum of the lengths of any two sides of a triangle must be greater than the length of the third side.,Triangle Properties,Geometry,6_Leaving Cert Maths-Geometry_Detail.pdf
6d2ee87c-486c-4737-b2d8-625f72b6df7e,Perpendicular Lines,Two lines that intersect at a right angle (90 degrees).,Line Relationships,Geometry,6_Leaving Cert Maths-Geometry_Detail.pdf
25004657-55f5-48d2-b631-47261dc1954c,Parallel Lines,Two lines that never intersect and are equidistant from each other at all points.,Line Relationships,Geometry,6_Leaving Cert Maths-Geometry_Detail.pdf
9f97e482-4272-483f-993c-4b8d7c82d738,Transversal Line,A line that intersects two or more other lines at distinct points.,Line Relationships,Geometry,6_Leaving Cert Maths-Geometry_Detail.pdf
9d90d299-dae4-465f-a3fd-03512fd43ae3,Circumcircle,The circle that passes through all the vertices of a triangle.,Circle Properties,Geometry,6_Leaving Cert Maths-Geometry_Detail.pdf
bb470e29-e62e-43d3-883e-34a9ca7f8bc0,Incenter,"The point where the angle bisectors of a triangle intersect, and it is the center of the incircle.",Triangle Centers,Geometry,6_Leaving Cert Maths-Geometry_Detail.pdf
ca426781-a598-4458-8b3b-eae1bf563a39,Centroid,"The point where the three medians of a triangle intersect, representing the triangle's center of mass.",Triangle Centers,Geometry,6_Leaving Cert Maths-Geometry_Detail.pdf
a0c821ae-bd57-494c-a796-3df2d89911f6,Orthocenter,The point where the three altitudes of a triangle intersect.,Triangle Centers,Geometry,6_Leaving Cert Maths-Geometry_Detail.pdf
498f7129-b26b-4de5-ab72-34a8cdc91586,Area of Triangle,The area of a triangle is calculated as half the product of its base and height.,Area Calculations,Geometry,6_Leaving Cert Maths-Geometry_Detail.pdf
8f5c3a5a-231c-49c8-8630-2f25ba9b3564,Area of Parallelogram,The area of a parallelogram is calculated as the product of its base and height.,Area Calculations,Geometry,6_Leaving Cert Maths-Geometry_Detail.pdf
549a7cc5-254d-4fbf-92e5-30743877687a,Chord of a Circle,A line segment whose endpoints both lie on the circle.,Circle Properties,Geometry,6_Leaving Cert Maths-Geometry_Detail.pdf
e43f3627-a3c4-4d82-8605-18da383ca27d,Diameter of a Circle,"A chord that passes through the center of the circle, measuring twice the radius.",Circle Properties,Geometry,6_Leaving Cert Maths-Geometry_Detail.pdf
ca47b5a9-89aa-4117-bf0a-9f91b3c7d920,Sector of a Circle,The area enclosed by two radii and the arc between them.,Circle Properties,Geometry,6_Leaving Cert Maths-Geometry_Detail.pdf
f708261e-e3df-4c43-868f-e07a5e8cffcb,Arc of a Circle,"A portion of the circumference of a circle, defined by two endpoints.",Circle Properties,Geometry,6_Leaving Cert Maths-Geometry_Detail.pdf
04038751-648d-43ee-997b-3793d3e76d92,Cyclic Quadrilateral,A quadrilateral whose vertices all lie on a single circle.,Quadrilateral Properties,Geometry,6_Leaving Cert Maths-Geometry_Detail.pdf
77654413-16c8-4d09-8725-0daaa94d083b,Exterior Angle of a Triangle,"An angle formed outside a triangle when one side is extended, equal to the sum of the two opposite interior angles.",Triangle Properties,Geometry,6_Leaving Cert Maths-Geometry_Detail.pdf
18f7adce-6eeb-4de7-a1a4-ae8f69a78b2f,Angle Sum of a Triangle,The sum of the interior angles of a triangle is always 180 degrees.,Triangle Properties,Geometry,6_Leaving Cert Maths-Geometry_Detail.pdf
75e15e7c-ed5c-4b33-8604-33eca605fea4,Circumradius,"The radius of the circumcircle of a triangle, which passes through all its vertices.",Triangle Properties,Geometry,6_Leaving Cert Maths-Geometry_Detail.pdf
7935e5ee-61f9-4dfb-b17c-7e1aa5494b73,Inradius,"The radius of the incircle of a triangle, which is tangent to all three sides.",Triangle Properties,Geometry,6_Leaving Cert Maths-Geometry_Detail.pdf
9621a921-e76d-4aa4-a86e-c0fda912fe3d,Listing Outcomes of Experiments,The process of systematically enumerating all possible outcomes of a probabilistic experiment.,Counting Principles,Probability,5_Curriculum csvs - Stats.csv
38851752-7a34-4fa3-a257-8fd93a2201db,Theoretical Probability,"The probability of an event occurring based on the possible outcomes in a perfect world, calculated as the ratio of favorable outcomes to total outcomes.",Concepts of Probability,Probability,5_Curriculum csvs - Stats.csv
c32e9a36-5f39-4b1a-8057-02c421c729c1,Experimental Probability,"The probability of an event occurring based on the results of an experiment, calculated as the ratio of the number of times the event occurs to the total number of trials.",Concepts of Probability,Probability,5_Curriculum csvs - Stats.csv
5d43c366-50c7-4fd7-a88f-29291891e760,Equally Likely Outcomes,"Outcomes that have the same probability of occurring, often used in the context of simple experiments like rolling dice or flipping coins.",Concepts of Probability,Probability,5_Curriculum csvs - Stats.csv
1f320280-9513-4fe2-baf8-06af72d9e0a4,Independent Events,Events where the occurrence of one event does not affect the occurrence of another event.,Outcomes of Simple Random Processes,Probability,5_Curriculum csvs - Stats.csv
23d33d64-a36e-403c-92fd-f6be18ba43ab,Addition Rule of Probability,"A formula used to calculate the probability of the union of two events, given by P(A ∪ B) = P(A) + P(B) − P(A ∩ B).",Basic Rules of Probability,Probability,5_Curriculum csvs - Stats.csv
09985252-1e7c-4e67-9628-6536333eed75,Multiplication Rule for Independent Events,"A formula used to calculate the probability of the intersection of two independent events, given by P(A ∩ B) = P(A) × P(B).",Basic Rules of Probability,Probability,5_Curriculum csvs - Stats.csv
9b655e37-bbc6-48f5-9c70-d623290595fd,Multiplication Rule (General Case),"A formula used to calculate the probability of the intersection of two events, given by P(A ∩ B) = P(A) × P(B | A).",Basic Rules of Probability,Probability,5_Curriculum csvs - Stats.csv
d1fcc1e3-69b9-4bec-8cdc-eeee051e1851,Expected Value,"A calculated average of all possible outcomes of a random variable, weighted by their probabilities, which may not necessarily be one of the outcomes.",Concepts of Probability,Probability,5_Curriculum csvs - Stats.csv
0111d6a0-4bca-4030-95fa-313ffc4e8f67,Sampling Distribution,The probability distribution of a statistic obtained by selecting random samples from a population.,Statistical Reasoning,Statistics,5_Curriculum csvs - Stats.csv
91c61c8a-0d37-4c72-be66-7f8c699e07b5,Bivariate Data,"Data that involves two different variables, allowing for analysis of the relationship between them.",Statistical Reasoning,Statistics,5_Curriculum csvs - Stats.csv
409faec5-3a31-4245-a0b5-2fb2043c0877,Simple Random Sample,A sampling method where each member of the population has an equal chance of being selected.,"Finding, Collecting and Organising Data",Statistics,5_Curriculum csvs - Stats.csv
d1f9c44a-11f5-42bd-add9-83c11e58222b,Stratified Sample,A sampling method that involves dividing the population into subgroups and taking a sample from each subgroup.,"Finding, Collecting and Organising Data",Statistics,5_Curriculum csvs - Stats.csv
92e98a4e-8fa4-42de-a489-dd33c671c79e,Cluster Sample,"A sampling method where the population is divided into clusters, and entire clusters are randomly selected.","Finding, Collecting and Organising Data",Statistics,5_Curriculum csvs - Stats.csv
bc1c46e9-87f3-452c-bc18-dbd89a283364,Bar Charts,A graphical representation of data using bars to show the frequency or value of categories.,Representing Data Graphically,Statistics,5_Curriculum csvs - Stats.csv
83aa89cb-1843-4161-89d9-f5c7f2e36b7f,Pie Charts,A circular statistical graphic divided into slices to illustrate numerical proportions.,Representing Data Graphically,Statistics,5_Curriculum csvs - Stats.csv
20915e02-ab99-46a7-8655-88b250ca0f41,Line Plots,"A method of displaying data along a number line, often used for small sets of data.",Representing Data Graphically,Statistics,5_Curriculum csvs - Stats.csv
05835479-08d0-4486-b025-eaec4e6d283e,Histograms,"A graphical representation of the distribution of numerical data, using bars to show the frequency of data intervals.",Representing Data Graphically,Statistics,5_Curriculum csvs - Stats.csv
f2e3e3a6-f8f9-4c94-a859-93567547d387,Mean,"The average of a set of numbers, calculated by dividing the sum of the values by the number of values.",Measures of Central Tendency,Statistics,5_Curriculum csvs - Stats.csv
83c0b4c4-32b2-4595-9d99-3a22f23fad29,Median,"The middle value in a set of numbers when they are arranged in order, or the average of the two middle values if the set has an even number of observations.",Measures of Central Tendency,Statistics,5_Curriculum csvs - Stats.csv
53b74e99-8f06-47b0-a49d-61509844ed9a,Mode,The value that appears most frequently in a data set.,Measures of Central Tendency,Statistics,5_Curriculum csvs - Stats.csv
d87ec95c-05e6-445e-a1b5-658ed5f22342,Standard Deviation,"A measure of the amount of variation or dispersion in a set of values, indicating how much the values deviate from the mean.",Measures of Variability,Statistics,5_Curriculum csvs - Stats.csv
ef3d05f6-1416-4a8d-aa46-30f839be5065,Interquartile Range,"The difference between the first quartile (Q1) and the third quartile (Q3) in a data set, representing the range of the middle 50% of the data.",Measures of Variability,Statistics,5_Curriculum csvs - Stats.csv
4729b222-6502-44af-b428-b766258a715f,Outliers,"Data points that differ significantly from other observations in a data set, which can affect statistical analyses.",Data Analysis,Statistics,5_Curriculum csvs - Stats.csv
efa8c5c4-43fc-4e47-826b-751393a6b8c8,Scatterplots,"A graphical representation of two variables, showing the relationship between them by plotting points on a Cartesian plane.",Bivariate Data Analysis,Statistics,5_Curriculum csvs - Stats.csv
5c95eb69-837b-48e5-a67b-a287008d3ec7,Probability of an event occurring,Concept referenced in relationship: Probability of an event occurring,Unknown,Unknown,5_Curriculum csvs - Stats.csv
fb5cf509-e8b3-4427-abdd-004147ae5978,Counting arrangements of n distinct objects (n!),Concept referenced in relationship: Counting arrangements of n distinct objects (n!),Unknown,Unknown,5_Curriculum csvs - Stats.csv
