id,name,explanation,broader_concept,strand,source
b112676e-0939-4ec6-bfd4-d3fa040747ba,solving quadratic equations by factorisation,Solving quadratic equations by expressing them as products of linear factors and setting each factor to zero.,equation solving,Algebra,8_Texts and Tests 4-Cut down.md
b319d497-9d71-4bbf-8d57-9f318d57f3c9,solving quadratic equations by quadratic formula,Using the quadratic formula to find roots of any quadratic equation.,equation solving,Algebra,8_Texts and Tests 4-Cut down.md
5cc9c541-87f4-4c6c-95e7-2bcb0a9b6890,solving quadratic equations by substitution,Using a substitution to convert a complex equation into a quadratic form and then solving.,equation solving,Algebra,8_Texts and Tests 4-Cut down.md
3574f0a9-7815-4821-9fe3-55a3afaccb30,discriminant of quadratic equation,The expression b^2 - 4ac that determines the nature of the roots of a quadratic equation.,quadratic equations,Algebra,8_Texts and Tests 4-Cut down.md
e91dd20a-8aca-4463-af85-803d9da9d576,nature of quadratic roots,"Classification of roots as real distinct, real equal, or imaginary based on the discriminant.",quadratic equations,Algebra,8_Texts and Tests 4-Cut down.md
3994f4d1-959e-4819-bc1d-4df0b59d8a4f,completing the square,Rewriting a quadratic expression in the form a(x - p)^2 + q to find minimum/maximum values and vertex.,quadratic functions,Algebra,8_Texts and Tests 4-Cut down.md
b4beca11-f8d5-4aaf-93a1-08d369539f8d,surds simplification,Simplifying irrational square roots by factoring out perfect squares and rationalising denominators.,irrational numbers,Algebra,8_Texts and Tests 4-Cut down.md
e393f2ee-5a52-4ac5-a506-3ddc9b559e1d,solving algebraic surd equations,"Solving equations involving square roots by isolating the surd and squaring both sides, checking for extraneous solutions.",equation solving,Algebra,8_Texts and Tests 4-Cut down.md
533305a7-bfa3-41dc-b304-e557ea5edf15,factor theorem,A polynomial f(x) has (x - k) as a factor if and only if f(k) = 0.,polynomial factorisation,Algebra,8_Texts and Tests 4-Cut down.md
c93fcad7-aae2-4b85-8e49-05076ec82d76,factorising cubic polynomials using factor theorem,"Finding an integer root by trial, then dividing the polynomial by the corresponding factor to reduce it to a quadratic.",polynomial factorisation,Algebra,8_Texts and Tests 4-Cut down.md
2be23041-6d64-4e37-8ab8-2008029f6fc2,graphs of cubic polynomials,"Understanding the shape, roots, turning points, and behavior of cubic polynomial graphs.",polynomial functions,Algebra,8_Texts and Tests 4-Cut down.md
82e38df6-d7cc-4732-888e-ccfa4c8bd846,radian measure,"Measuring angles by the length of the arc subtended on a circle of radius one, where 2π radians equals 360 degrees.",angle measurement,Trigonometry,8_Texts and Tests 4-Cut down.md
7cb6d096-9e56-495c-a05d-d360b16be4b8,arc length formula,"Length of an arc l = rθ, where r is radius and θ is angle in radians.",circle geometry,Trigonometry,8_Texts and Tests 4-Cut down.md
7c41f8c6-3e4b-494f-a1c9-e9a089f06f21,area of sector formula,"Area of sector = ½ r² θ, where r is radius and θ is angle in radians.",circle geometry,Trigonometry,8_Texts and Tests 4-Cut down.md
94f639e3-6dc8-4fc7-8717-3e785b6a3eba,basic trigonometric ratios,"Definitions of sine, cosine, and tangent as ratios of sides in a right-angled triangle.",trigonometric ratios,Trigonometry,8_Texts and Tests 4-Cut down.md
203379f7-929c-4615-b253-adab28d496e1,trigonometric ratios of special angles,"Exact sine, cosine, and tangent values for 30°, 45°, and 60° angles.",trigonometric ratios,Trigonometry,8_Texts and Tests 4-Cut down.md
635c91cf-4076-4018-a095-fe8aa002440b,using inverse trigonometric functions on calculator,"Using sin⁻¹, cos⁻¹, tan⁻¹ keys to find angles from given trigonometric ratios.",trigonometric functions,Trigonometry,8_Texts and Tests 4-Cut down.md
be138e9b-a440-4db0-adde-fc4b47cf742c,unit circle coordinates,"Coordinates of a point on the unit circle are (cos θ, sin θ).",trigonometric functions,Trigonometry,8_Texts and Tests 4-Cut down.md
bf97cd60-3af4-4a11-b1ea-92680fd7fee1,signs of trigonometric functions in quadrants,"Determining positive or negative values of sine, cosine, and tangent in each of the four quadrants.",trigonometric functions,Trigonometry,8_Texts and Tests 4-Cut down.md
c4d15f21-8259-474f-b9f5-8935cbc59d5e,area of triangle using sine,"Area = ½ ab sin C, where a and b are sides and C is the included angle.",triangle relationships,Trigonometry,8_Texts and Tests 4-Cut down.md
60f2d593-820d-4a7f-85f2-34e59b60d889,trigonometric problems in three dimensions,Using trigonometry to find lengths and angles in 3D figures by decomposing into triangles.,spatial trigonometry,Trigonometry,8_Texts and Tests 4-Cut down.md
babad99c-6556-45df-a5a5-d599eb0f2462,"graphs of sine, cosine and tangent functions","Periodic graphs with specific ranges, periods, and asymptotes for sine, cosine, and tangent.",trigonometric functions,Trigonometry,8_Texts and Tests 4-Cut down.md
ea36f1df-272e-4ba6-b5fc-6dde47cd0f80,amplitude and period changes of trigonometric graphs,Effects of coefficients on the amplitude and period of sine and cosine graphs.,trigonometric functions,Trigonometry,8_Texts and Tests 4-Cut down.md
651be3bc-3dd1-4ceb-aff6-b02313e6482c,general solution of trigonometric equations,Finding all solutions of equations like sin x = k or cos x = k by adding multiples of the period.,trigonometric equations,Trigonometry,8_Texts and Tests 4-Cut down.md
d70b8cd8-7f52-42f5-b827-2e31b5744ad1,distance formula between two points,Distance = sqrt((x2 - x1)^2 + (y2 - y1)^2) in coordinate geometry.,coordinate geometry,Geometry,8_Texts and Tests 4-Cut down.md
1e787acf-00a0-4152-8ac4-fd69100a77a8,midpoint formula,"Midpoint of segment joining (x1, y1) and (x2, y2) is ((x1+x2)/2, (y1+y2)/2).",coordinate geometry,Geometry,8_Texts and Tests 4-Cut down.md
88581015-809f-44fe-83f3-116fda6653ee,conditions for parallel lines,Two lines are parallel if their slopes are equal.,coordinate geometry,Geometry,8_Texts and Tests 4-Cut down.md
67eafcb3-83f1-4e37-9ba7-b2687b66229f,conditions for perpendicular lines,Two lines are perpendicular if the product of their slopes is -1.,coordinate geometry,Geometry,8_Texts and Tests 4-Cut down.md
63376869-8874-4812-afcf-ca2c019451eb,area of triangle using coordinate geometry,"Area = ½ |x1 y2 - x2 y1| for triangle with vertices at (0,0), (x1,y1), (x2,y2).",coordinate geometry,Geometry,8_Texts and Tests 4-Cut down.md
f4ff1b29-d488-4675-8bd6-f6ed91bcbd36,equation of a line from point and slope,"Equation y - y1 = m(x - x1) for line through (x1,y1) with slope m.",coordinate geometry,Geometry,8_Texts and Tests 4-Cut down.md
28483474-e5e2-4b81-88eb-6db41ec7535d,dividing a line segment internally in a given ratio,"Coordinates of point dividing segment AB in ratio a:b are ((b x1 + a x2)/(a+b), (b y1 + a y2)/(a+b)).",coordinate geometry,Geometry,8_Texts and Tests 4-Cut down.md
01816f14-9dc9-4e1b-a138-1aaf4d3b7170,centroid of a triangle,"Point of intersection of medians, coordinates are average of vertices: ((x1+x2+x3)/3, (y1+y2+y3)/3).",triangle centres,Geometry,8_Texts and Tests 4-Cut down.md
cdd03b91-3247-4cfb-a4bc-3a2ecd32b172,orthocentre of a triangle,Point of intersection of altitudes (perpendiculars from vertices to opposite sides).,triangle centres,Geometry,8_Texts and Tests 4-Cut down.md
98fcca58-eb3b-42e6-b6fa-4c933fadadc0,perpendicular distance from point to line,"Distance = |a x1 + b y1 + c| / sqrt(a^2 + b^2) from point (x1,y1) to line ax + by + c = 0.",coordinate geometry,Geometry,8_Texts and Tests 4-Cut down.md
dde33cb6-ff4a-440f-aaa5-8070c979c3fb,angle between two lines,tan θ = |(m1 - m2) / (1 + m1 m2)| where m1 and m2 are slopes of the lines.,coordinate geometry,Geometry,8_Texts and Tests 4-Cut down.md
0b638493-90d7-4365-a0af-3edcd7041995,linear relationship modeling,Using straight line graphs to model relationships between variables and solve related problems.,coordinate geometry,Geometry,8_Texts and Tests 4-Cut down.md
34117031-e80e-4b35-aa0b-036d31cdaefb,fundamental principle of counting,"If one task can be done in m ways and a second in n ways, then both tasks can be done in m × n ways.",counting principles,Probability,8_Texts and Tests 4-Cut down.md
8c585788-0f26-40fa-826b-1b78c38ead9e,factorial notation,Notation n! represents the product of all positive integers from n down to 1.,counting principles,Probability,8_Texts and Tests 4-Cut down.md
edee43cb-dcf6-4e13-86b1-7503c7309177,permutations of n objects,Number of ways to arrange n distinct objects in order is n!.,counting principles,Probability,8_Texts and Tests 4-Cut down.md
fe4c7422-df72-4663-adec-0701f4500fe1,permutations of n objects taken r at a time,"Number of ordered arrangements of r objects chosen from n distinct objects is P(n,r) = n!/(n-r)!.",counting principles,Probability,8_Texts and Tests 4-Cut down.md
88ed4181-3efb-411c-a9e7-85d9cbb38c90,combinations of n objects taken r at a time,"Number of unordered selections of r objects from n distinct objects is C(n,r) = n! / (r! (n-r)!).",counting principles,Probability,8_Texts and Tests 4-Cut down.md
2af118eb-ef31-4acf-84cc-92e58cd0acaa,elementary probability,Probability of an event is the ratio of favorable outcomes to total possible outcomes.,probability basics,Probability,8_Texts and Tests 4-Cut down.md
1835a870-744f-452d-ad68-aa73ce64047c,sample space,The set of all possible outcomes of an experiment.,probability basics,Probability,8_Texts and Tests 4-Cut down.md
a445bb76-9fcc-411c-897f-25f51560da80,mutually exclusive events,"Events that cannot occur simultaneously, so P(A or B) = P(A) + P(B).",probability rules,Probability,8_Texts and Tests 4-Cut down.md
f581c125-6faf-4930-a8bf-ecb79ca6f19f,addition rule for non-mutually exclusive events,P(A or B) = P(A) + P(B) - P(A and B) when events can occur together.,probability rules,Probability,8_Texts and Tests 4-Cut down.md
88de8671-69cc-4121-993f-bb52b55304bb,exhaustive events,"A set of events that covers all possible outcomes, so their probabilities sum to 1.",probability basics,Probability,8_Texts and Tests 4-Cut down.md
2bfc6b7c-1203-4b44-9cb2-d1fc7ae448d8,conditional probability,"Probability of event A given event B has occurred, P(A|B) = P(A and B) / P(B).",probability rules,Probability,8_Texts and Tests 4-Cut down.md
e7c4a03d-10b7-4f28-845f-427dd897ef61,multiplication law for independent events,"For independent events A and B, P(A and B) = P(A) × P(B).",probability rules,Probability,8_Texts and Tests 4-Cut down.md
dfe01244-8f9a-4fbb-8ceb-2bb8221fdba8,circle equation with centre at origin,"Equation x² + y² = r² represents a circle centred at (0,0) with radius r.",circle geometry,Coordinate Geometry,8_Texts and Tests 4-Cut down.md
b2f38320-4195-4093-a88d-f3cc94442d89,circle equation with centre not at origin,"Equation (x - h)² + (y - k)² = r² represents a circle centred at (h,k) with radius r.",circle geometry,Coordinate Geometry,8_Texts and Tests 4-Cut down.md
076b8d29-ed9c-48a5-ad5b-c7192a048133,general form of circle equation,"Equation x² + y² + 2gx + 2fy + c = 0 represents a circle with centre (-g,-f) and radius sqrt(g² + f² - c).",circle geometry,Coordinate Geometry,8_Texts and Tests 4-Cut down.md
92d44e58-ca69-4346-96e2-1b2dd17559cd,tangent to a circle,A line that touches the circle at exactly one point and is perpendicular to the radius at the point of contact.,circle geometry,Coordinate Geometry,8_Texts and Tests 4-Cut down.md
08d276c9-d718-406a-a61e-22cdf705b36d,equation of tangent to a circle at a point,Line perpendicular to radius at point of contact; slope is negative reciprocal of radius slope; use point-slope form.,circle geometry,Coordinate Geometry,8_Texts and Tests 4-Cut down.md
83b98e34-17ed-459b-805f-f26662862993,common chord of two circles,"Line passing through points of intersection of two circles, found by subtracting their equations.",circle geometry,Coordinate Geometry,8_Texts and Tests 4-Cut down.md
7d3bbcfe-5c2c-4b6c-9563-b5a8c4dd3a4c,circles touching externally,Two circles touching externally have distance between centres equal to sum of their radii.,circle geometry,Coordinate Geometry,8_Texts and Tests 4-Cut down.md
060bcde9-df6d-4719-9ae3-d038219a4f2c,circles touching internally,Two circles touching internally have distance between centres equal to difference of their radii.,circle geometry,Coordinate Geometry,8_Texts and Tests 4-Cut down.md
20b7c296-95c2-4e41-82f1-12223ef88a34,length of tangent from a point to a circle,"Length of tangent PT = sqrt(PO² - r²), where PO is distance from point to centre and r is radius.",circle geometry,Coordinate Geometry,8_Texts and Tests 4-Cut down.md
78581431-c9f4-4514-b952-88ab966d7527,differentiation from first principles,Finding the derivative as the limit of the difference quotient as h approaches zero.,differentiation,Calculus,8_Texts and Tests 4-Cut down.md
ba3e6758-be3c-4ce8-b2fc-93c3d3526ae4,power rule for differentiation,Derivative of x^n is n x^(n-1) for any real number n.,differentiation rules,Calculus,8_Texts and Tests 4-Cut down.md
4085774d-c944-4be6-ab3a-c0e01eabef9a,sum and difference rule for differentiation,Derivative of sum/difference is sum/difference of derivatives.,differentiation rules,Calculus,8_Texts and Tests 4-Cut down.md
39a682a5-9790-48d5-a882-388a587a1d9c,product rule for differentiation,Derivative of product uv is u dv/dx + v du/dx.,differentiation rules,Calculus,8_Texts and Tests 4-Cut down.md
ca6452ca-ee95-4fc4-a00c-9ffa6910f8a5,quotient rule for differentiation,Derivative of u/v is (v du/dx - u dv/dx) / v^2.,differentiation rules,Calculus,8_Texts and Tests 4-Cut down.md
c618e22d-0c92-4b08-aa0a-1305ba378254,chain rule for differentiation,Derivative of composite function y = f(g(x)) is dy/dx = dy/du × du/dx.,differentiation rules,Calculus,8_Texts and Tests 4-Cut down.md
0a3bf56b-88c2-46ad-a0df-1a26d59171e6,second derivative,"Derivative of the first derivative, representing the rate of change of the slope.",differentiation,Calculus,8_Texts and Tests 4-Cut down.md
d587ff13-b8e8-4a54-8204-fc92eba8feca,"derivatives of sine, cosine and tangent",d/dx(sin x) = cos x; d/dx(cos x) = -sin x; d/dx(tan x) = sec^2 x.,differentiation of trigonometric functions,Calculus,8_Texts and Tests 4-Cut down.md
3776a66e-0643-4634-90bf-c643508f6201,derivatives of inverse trigonometric functions,"Derivatives of arcsin, arccos, arctan functions with respect to x, involving square roots and rational expressions.",differentiation of inverse trig functions,Calculus,8_Texts and Tests 4-Cut down.md
7a8e3367-247c-43c0-9754-1b6ee6e4ff53,derivative of exponential function,"Derivative of e^x is e^x; more generally, derivative of e^{ax} is a e^{ax}.",differentiation of exponential functions,Calculus,8_Texts and Tests 4-Cut down.md
bf1131f5-d37f-48f5-a125-2cc87cb79707,derivative of logarithmic function,Derivative of ln x is 1/x; derivative of ln f(x) is f'(x)/f(x).,differentiation of logarithmic functions,Calculus,8_Texts and Tests 4-Cut down.md
8a115dc3-a65c-4dfb-9fd3-93ebaa20bccc,compound angle formulae for sine and cosine,Formulas expressing sin(A±B) and cos(A±B) in terms of sin and cos of A and B.,trigonometric identities,Trigonometry,8_Texts and Tests 4-Cut down.md
573782c8-1237-4b02-a4ea-c6ef68f86e4f,double-angle formulae,"Formulas for sin 2A, cos 2A, and tan 2A expressed in terms of sin A, cos A, and tan A.",trigonometric identities,Trigonometry,8_Texts and Tests 4-Cut down.md
57c25e56-9416-4167-bb3e-8f0499ca99cb,sum-to-product and product-to-sum formulae,Formulas converting sums/differences of sines and cosines into products and vice versa.,trigonometric identities,Trigonometry,8_Texts and Tests 4-Cut down.md
fb0451b6-cb3f-4f7a-8efb-a124e3bb586b,inverse trigonometric functions,"Functions that return the angle whose sine, cosine or tangent is a given value, e.g. arcsin, arccos, arctan.",trigonometric functions,Trigonometry,8_Texts and Tests 4-Cut down.md
0ceca190-c420-4814-95ed-0cb966a58835,Double Angle Formulae,Concept referenced in relationship: Double Angle Formulae,Unknown,Unknown,8_Texts and Tests 4-Cut down.md
5619d9e8-773e-4f07-ac05-cd4abdcd11f3,Half-Angle Formulae,Concept referenced in relationship: Half-Angle Formulae,Unknown,Unknown,8_Texts and Tests 4-Cut down.md
6ba8e585-12d7-4b0a-9d50-dc8340ccca2e,Graphs of trigonometric functions,Concept referenced in relationship: Graphs of trigonometric functions,Unknown,Unknown,8_Texts and Tests 4-Cut down.md
052b9e3a-3586-4b8f-8fcf-e945697df000,Polynomial functions,Concept referenced in relationship: Polynomial functions,Unknown,Unknown,8_Texts and Tests 4-Cut down.md
ecff8ae1-bd3e-4f6f-9cf1-4340f501af0e,Factorising algebraic expressions,Concept referenced in relationship: Factorising algebraic expressions,Unknown,Unknown,8_Texts and Tests 4-Cut down.md
bb5d2d12-3743-49b8-a612-8a140aef6a74,Simplifying algebraic fractions,Concept referenced in relationship: Simplifying algebraic fractions,Unknown,Unknown,8_Texts and Tests 4-Cut down.md
dd522049-06e5-4b5c-9864-842fe6ea5874,Binomial expansions,Concept referenced in relationship: Binomial expansions,Unknown,Unknown,8_Texts and Tests 4-Cut down.md
4a5abcc7-6521-49f2-a873-63092ef8e635,Solving equations,Concept referenced in relationship: Solving equations,Unknown,Unknown,8_Texts and Tests 4-Cut down.md
ee3ea5c2-3b22-4cc7-85c7-0595da40290d,Solving simultaneous linear equations,Concept referenced in relationship: Solving simultaneous linear equations,Unknown,Unknown,8_Texts and Tests 4-Cut down.md
6d2a62f5-1f52-455e-9f21-a6da1fbe3a98,Solving quadratic and linear equations in context,Concept referenced in relationship: Solving quadratic and linear equations in context,Unknown,Unknown,8_Texts and Tests 4-Cut down.md
78fc52cb-bb57-4525-a865-5b7af125586a,Forming quadratic equations from their roots,Concept referenced in relationship: Forming quadratic equations from their roots,Unknown,Unknown,8_Texts and Tests 4-Cut down.md
8de66217-5ff6-4d68-8f6d-524d32a8e4b7,Max and min of quadratic graphs,Concept referenced in relationship: Max and min of quadratic graphs,Unknown,Unknown,8_Texts and Tests 4-Cut down.md
e00905ac-dae1-4a97-8955-859c509ad039,Differentiation by rule,Concept referenced in relationship: Differentiation by rule,Unknown,Unknown,8_Texts and Tests 4-Cut down.md
b791b9d5-6101-44be-b762-5d8a3782db37,Differentiation of exponential functions,Concept referenced in relationship: Differentiation of exponential functions,Unknown,Unknown,8_Texts and Tests 4-Cut down.md
5ab402db-eac3-4f7d-aaac-2dae4ce8914d,Differentiation of logarithmic functions,Concept referenced in relationship: Differentiation of logarithmic functions,Unknown,Unknown,8_Texts and Tests 4-Cut down.md
7ea521e8-de2f-4526-9f46-027ca4dc8c8e,Geometric series,Concept referenced in relationship: Geometric series,Unknown,Unknown,8_Texts and Tests 4-Cut down.md
ddc4529c-efc3-4582-a583-48f4988292c0,Recurring decimals,Concept referenced in relationship: Recurring decimals,Unknown,Unknown,8_Texts and Tests 4-Cut down.md
00655b1a-b00d-430e-8441-afa68912d4d2,Number patterns - Revisited,Concept referenced in relationship: Number patterns - Revisited,Unknown,Unknown,8_Texts and Tests 4-Cut down.md
dad375d8-6843-4c95-b675-48bd04e15be3,Coordinate Geometry: The Line,Concept referenced in relationship: Coordinate Geometry: The Line,Unknown,Unknown,8_Texts and Tests 4-Cut down.md
7f7a9202-f230-4217-a716-b1303813882b,Equation of a circle with centre not at origin,Concept referenced in relationship: Equation of a circle with centre not at origin,Unknown,Unknown,8_Texts and Tests 4-Cut down.md
38028c56-6b5b-47aa-ba1e-cbfdf0372ca2,Finding the equation of a circle,Concept referenced in relationship: Finding the equation of a circle,Unknown,Unknown,8_Texts and Tests 4-Cut down.md
b63c8a0a-66ae-4b70-a971-8afeb5e5ae8f,Tangents to a circle,Concept referenced in relationship: Tangents to a circle,Unknown,Unknown,8_Texts and Tests 4-Cut down.md
44baa2ae-51b1-4624-a498-6aed3992ad27,Points of intersection of a line and a circle,Concept referenced in relationship: Points of intersection of a line and a circle,Unknown,Unknown,8_Texts and Tests 4-Cut down.md
297c53a6-75dc-4217-8a41-38ac13a0cc7b,Chords and circles,Concept referenced in relationship: Chords and circles,Unknown,Unknown,8_Texts and Tests 4-Cut down.md
6c62e1b6-770d-42fa-9777-7ed907223cb1,Circles touching the x-axis or y-axis,Concept referenced in relationship: Circles touching the x-axis or y-axis,Unknown,Unknown,8_Texts and Tests 4-Cut down.md
b80e7305-76d8-4bfc-a879-25e01ed2c0dd,Irrational number as non-repeating non-terminating decimal,An irrational number is a real number that cannot be expressed as a ratio of two integers and has a decimal expansion that neither terminates nor repeats.,Number systems,Number,9_Texts and tests 5- Cut down.md
2018311d-bdc6-4547-ae76-aef78fa7623d,Simplification of surds by factorization,"The process of simplifying surds by expressing the radicand as a product of a perfect square and another factor, then taking the square root of the perfect square outside the radical.",Surds and radicals,Number,9_Texts and tests 5- Cut down.md
26de43d4-34fc-424f-96bc-0950ff4b7fb2,Geometric construction of line segment of length sqrt(2),"Using compass and straightedge to construct a line segment on the number line whose length is the square root of 2, based on the Pythagorean theorem.",Geometric constructions,Geometry,9_Texts and tests 5- Cut down.md
7e934eee-2bf7-46fb-8b21-91ebbc65bf10,Geometric construction of line segment of length sqrt(3),"Using compass and straightedge to construct a line segment on the number line whose length is the square root of 3, based on the Pythagorean theorem.",Geometric constructions,Geometry,9_Texts and tests 5- Cut down.md
a7ba84b7-7865-4597-99fd-b7d4751e3a6a,Complex number in rectangular form,"A complex number expressed as z = x + iy, where x is the real part and y is the imaginary part.",Complex numbers,Complex Numbers,9_Texts and tests 5- Cut down.md
d82d9fb7-7cb3-4cd9-a723-0c1ecc1ac10b,Imaginary unit i and its powers,"The imaginary unit i is defined as sqrt(-1), with powers cycling every four steps: i^1 = i, i^2 = -1, i^3 = -i, i^4 = 1, and so on.",Complex numbers,Complex Numbers,9_Texts and tests 5- Cut down.md
5cc9babe-6631-4a41-a9e9-6b4d64df86b4,Addition and subtraction of complex numbers in rectangular form,Adding or subtracting complex numbers by separately adding or subtracting their real parts and their imaginary parts.,Complex numbers operations,Complex Numbers,9_Texts and tests 5- Cut down.md
02e01ec2-ae30-4159-af1c-d3b17fd6533f,Multiplication of complex numbers in rectangular form,Multiplying complex numbers using distributive property and the fact that i^2 = -1.,Complex numbers operations,Complex Numbers,9_Texts and tests 5- Cut down.md
3b815388-44e7-4b72-8b55-afb3b5e941fa,Complex conjugate and its properties,"The complex conjugate of z = a + bi is z̄ = a - bi, and the product z z̄ = a^2 + b^2 is a real number.",Complex numbers,Complex Numbers,9_Texts and tests 5- Cut down.md
91640faf-dbdb-4c36-9883-d74243daa606,Division of complex numbers using conjugates,Dividing complex numbers by multiplying numerator and denominator by the conjugate of the denominator to obtain a real denominator.,Complex numbers operations,Complex Numbers,9_Texts and tests 5- Cut down.md
0a481903-8642-4fa9-8ac0-bc7217a963b1,Equality of complex numbers,Two complex numbers are equal if and only if their real parts are equal and their imaginary parts are equal.,Complex numbers,Complex Numbers,9_Texts and tests 5- Cut down.md
dfaf759c-b97b-4da3-a343-ea0146d4a646,Square root of a complex number in rectangular form,Expressing the square root of a complex number a + bi as x + yi by solving simultaneous equations derived from (x + yi)^2 = a + bi.,Complex numbers,Complex Numbers,9_Texts and tests 5- Cut down.md
e26ba682-4562-4925-a28a-70ca73b121ac,Argand diagram representation of complex numbers,Plotting complex numbers as points in the complex plane with the real part on the x-axis and the imaginary part on the y-axis.,Complex numbers geometry,Complex Numbers,9_Texts and tests 5- Cut down.md
ad3abc9d-c717-446d-87f6-f1d6bed03673,Modulus of a complex number,"The modulus of a complex number z = a + bi is the distance from the origin to the point (a,b) in the Argand diagram, given by |z| = sqrt(a^2 + b^2).",Complex numbers geometry,Complex Numbers,9_Texts and tests 5- Cut down.md
2a730950-7490-490b-ad33-58646219c6f8,Triangle inequality for complex numbers,"For complex numbers z1 and z2, the modulus satisfies |z1 + z2| ≤ |z1| + |z2|.",Complex numbers geometry,Complex Numbers,9_Texts and tests 5- Cut down.md
711a57f7-d4e9-413c-a94d-904748942ec6,Transformation of complex numbers by multiplication by a real scalar,Multiplying a complex number by a real number scales its modulus by the absolute value of the scalar and may reflect it through the origin if the scalar is negative.,Complex numbers transformations,Complex Numbers,9_Texts and tests 5- Cut down.md
a366a4cf-ec00-4761-95ab-ee98fc8e9b96,Translation of complex numbers by addition,Adding a fixed complex number to other complex numbers translates their points in the Argand plane by the vector corresponding to the added number.,Complex numbers transformations,Complex Numbers,9_Texts and tests 5- Cut down.md
02613a2e-4d30-4d0e-a866-18da5c0349c7,Rotation of complex numbers by multiplication by i,Multiplying a complex number by i corresponds to a rotation of the point by 90 degrees counterclockwise about the origin in the Argand plane.,Complex numbers transformations,Complex Numbers,9_Texts and tests 5- Cut down.md
3a3a0e1b-14c7-443f-9ce9-da6aecaa3c3d,Conjugate roots theorem,"If a polynomial with real coefficients has a complex root z, then its complex conjugate z̄ is also a root.",Complex numbers roots,Complex Numbers,9_Texts and tests 5- Cut down.md
