id,name,explanation,broader_concept,strand,source
cd804290-e012-4e24-a72a-8ee042270e0f,derivative of a constant function,"The derivative of a constant function y = c is zero, since the function has zero rate of change.",Calculus Concepts,Differential Calculus,8_Texts and Tests 4-Cut down.md
dcd94741-5321-4368-9979-b87e120264d1,sum and difference rule for derivatives,The derivative of a sum or difference of functions is the sum or difference of their derivatives.,Calculus Concepts,Differential Calculus,8_Texts and Tests 4-Cut down.md
5f989d88-d39d-4a0a-8adb-239a3fd259a2,derivative of reciprocal powers,"To differentiate functions like y = 1/x^n, rewrite as y = x^{-n} and apply the power rule.",Calculus Concepts,Differential Calculus,8_Texts and Tests 4-Cut down.md
d4f0c97e-8ca3-44aa-b432-4cd5e32d4e72,product rule for differentiation,"If y = u(x) * v(x), then dy/dx = u * dv/dx + v * du/dx.",Calculus Concepts,Differential Calculus,8_Texts and Tests 4-Cut down.md
82fafb87-e72c-43fd-a40a-171134a15c2f,quotient rule for differentiation,"If y = u(x)/v(x), then dy/dx = (v * du/dx - u * dv/dx) / v^2.",Calculus Concepts,Differential Calculus,8_Texts and Tests 4-Cut down.md
312f8991-ffa9-4f2d-b136-28473cfe2eab,chain rule for differentiation,"If y = f(g(x)), then dy/dx = f'(g(x)) * g'(x).",Calculus Concepts,Differential Calculus,8_Texts and Tests 4-Cut down.md
972afcd2-ed3d-4f5e-a6ca-44b537ff7401,derivative of sine function,The derivative of sin x with respect to x is cos x.,Calculus Concepts,Differential Calculus - Trigonometric Functions,8_Texts and Tests 4-Cut down.md
dc1c82d7-11fb-44e4-ad29-e3092e03af62,derivative of cosine function,The derivative of cos x with respect to x is -sin x.,Calculus Concepts,Differential Calculus - Trigonometric Functions,8_Texts and Tests 4-Cut down.md
c6d02bbe-685b-4a7e-a576-dc0eeead1f97,derivative of tangent function,The derivative of tan x with respect to x is sec^2 x.,Calculus Concepts,Differential Calculus - Trigonometric Functions,8_Texts and Tests 4-Cut down.md
8ee18293-f717-449e-9169-cbf9861aae6c,derivative of inverse sine function,"If y = sin^{-1}(x/a), then dy/dx = 1 / sqrt(a^2 - x^2).",Calculus Concepts,Differential Calculus - Inverse Trigonometric Functions,8_Texts and Tests 4-Cut down.md
459887cb-8777-439f-9cdf-7256de4c81dc,derivative of inverse tangent function,"If y = tan^{-1}(x/a), then dy/dx = a / (a^2 + x^2).",Calculus Concepts,Differential Calculus - Inverse Trigonometric Functions,8_Texts and Tests 4-Cut down.md
7eccf480-6b83-4ea2-bad8-1d9ceec3d0b6,derivative of inverse cosine function,"If y = cos^{-1}(x/a), then dy/dx = -1 / sqrt(a^2 - x^2).",Calculus Concepts,Differential Calculus - Inverse Trigonometric Functions,8_Texts and Tests 4-Cut down.md
4b6f1649-310d-4920-a9f6-59c2ac5790f9,derivative of exponential function e^x,The derivative of e^x with respect to x is e^x.,Calculus Concepts,Differential Calculus - Exponential Functions,8_Texts and Tests 4-Cut down.md
66a996c7-2582-4a05-a5d3-3ad17b0a68e7,derivative of exponential function e^{ax},"If y = e^{ax}, then dy/dx = a e^{ax}.",Calculus Concepts,Differential Calculus - Exponential Functions,8_Texts and Tests 4-Cut down.md
b34280b6-6b47-482a-af22-176ea73b4f36,derivative of logarithmic function ln x,The derivative of ln x with respect to x is 1/x.,Calculus Concepts,Differential Calculus - Logarithmic Functions,8_Texts and Tests 4-Cut down.md
d7cbad80-c2ba-4c57-8af2-febee4161db7,derivative of logarithmic function ln f(x),"If y = ln(f(x)), then dy/dx = f'(x)/f(x).",Calculus Concepts,Differential Calculus - Logarithmic Functions,8_Texts and Tests 4-Cut down.md
a6ffc10a-296a-4b35-91c9-2d3b738c475c,second derivative of a function,"The derivative of the first derivative of a function, denoted d^2y/dx^2 or f''(x), representing the rate of change of the slope.",Calculus Concepts,Differential Calculus,8_Texts and Tests 4-Cut down.md
4344bd28-8292-41d1-87b4-0755c3bc91bb,trigonometric identity cos^2 θ + sin^2 θ = 1,"Fundamental identity relating the squares of sine and cosine of the same angle, true for all θ.",Calculus Concepts,Trigonometry,8_Texts and Tests 4-Cut down.md
9a8ec697-9fcf-4b3b-993b-3e9087f9fbef,compound angle formula for cosine,"Formula expressing cos(A ± B) in terms of cos A, cos B, sin A, and sin B: cos(A ± B) = cos A cos B ∓ sin A sin B.",Calculus Concepts,Trigonometry,8_Texts and Tests 4-Cut down.md
34754ef0-d8a6-41eb-b295-83554ea854e1,compound angle formula for sine,"Formula expressing sin(A ± B) in terms of sin A, cos B, cos A, and sin B: sin(A ± B) = sin A cos B ± cos A sin B.",Calculus Concepts,Trigonometry,8_Texts and Tests 4-Cut down.md
b995cef0-34f9-4b39-9644-ebbb91920597,compound angle formula for tangent,Formula expressing tan(A ± B) in terms of tan A and tan B: tan(A ± B) = (tan A ± tan B) / (1 ∓ tan A tan B).,Calculus Concepts,Trigonometry,8_Texts and Tests 4-Cut down.md
c1a33e26-9a59-4110-8632-6d618a39d09b,sum to infinity of a geometric series with |r|<1,The sum to infinity of a geometric series with common ratio |r|<1 is S_infinity = a / (1 - r).,Calculus Concepts,Sequences and Series,8_Texts and Tests 4-Cut down.md
1b289e40-15ea-4af2-b7d7-8976477929d9,equation of a tangent to a circle,"The linear equation of the tangent line to a circle at a given point on the circle, found using the slope of the radius and point-slope form.",circle geometry,coordinate geometry,8_Texts and Tests 4-Cut down.md
d2936d7a-8d5a-4f17-894a-18b087dc1c35,perpendicular bisector of a chord,The line perpendicular to a chord of a circle that passes through the midpoint of the chord and contains the centre of the circle.,circle geometry,coordinate geometry,8_Texts and Tests 4-Cut down.md
d5a28ed1-ed88-4765-a505-bc04fde3a527,common tangent of two circles,"A line that touches two circles at exactly one point each, either externally or internally.",circle geometry,coordinate geometry,8_Texts and Tests 4-Cut down.md
d5776626-a4c1-4b33-bb69-cd97d28be418,modulus (absolute value) function,"A function that returns the non-negative value of a number or expression, denoted by |x|.",functions and equations,algebra,8_Texts and Tests 4-Cut down.md
142c9715-a216-4450-9743-6c9ada975bd6,modular equations and inequalities,"Equations and inequalities involving modulus expressions, solved by considering positive and negative cases or squaring.",equations and inequalities,algebra,8_Texts and Tests 4-Cut down.md
6d3346da-9cd5-41f8-8884-c1840332b4f5,proof by contradiction,"A method of mathematical proof where assuming the negation of a statement leads to a contradiction, proving the original statement true.",mathematical reasoning,algebra,8_Texts and Tests 4-Cut down.md
115c396a-9886-4a1e-a75a-c8102380f9fd,proof by induction,"A method of proof for statements involving natural numbers, proving the base case and then the inductive step to establish truth for all natural numbers.",mathematical reasoning,algebra,8_Texts and Tests 4-Cut down.md
9bc083a5-6f88-4e1f-8244-8f3399c763b9,direct proof,"A method of proof using axioms, definitions, and previously proven theorems to establish the truth of a statement.",mathematical reasoning,algebra,8_Texts and Tests 4-Cut down.md
674554b9-22a2-4e59-a3fb-ac3ac0d10ff8,abstract inequalities,"Inequalities involving algebraic expressions with variables, proven using algebraic manipulation and properties of squares.",inequalities,algebra,8_Texts and Tests 4-Cut down.md
5c1abe59-cd8f-404b-b665-88ac3d2de27d,proofs of divisibility,"Mathematical proofs showing that expressions are divisible by a given number for all natural numbers, often using induction.",number theory,algebra,8_Texts and Tests 4-Cut down.md
4e49fdac-9762-4c06-af3e-49eb7c852544,exponential growth and decay models,"Mathematical models describing quantities that increase or decrease exponentially over time, using functions of the form A·a^x or A·e^{bx}.",functions and modelling,algebra,8_Texts and Tests 4-Cut down.md
92012d93-ea13-42b4-b464-ef76e46b8f11,doubling time,"The time required for an exponentially growing quantity to double in size, calculated using logarithms and growth constants.",functions and modelling,algebra,8_Texts and Tests 4-Cut down.md
c9c0ae8d-813e-413c-b63c-307401e1d720,logarithmic equations,"Equations involving logarithms, solved by applying log laws, changing bases, and converting to exponential form.",functions and equations,algebra,8_Texts and Tests 4-Cut down.md
2b6d8bc7-7a5b-45aa-a7ed-11743391c913,laws of logarithms,"Fundamental properties of logarithms including product, quotient, power, and change of base rules.",functions and equations,algebra,8_Texts and Tests 4-Cut down.md
0b5aa548-42b9-46ea-9014-047a28fea616,inverse trigonometric functions,"Functions that give the angle whose sine, cosine, or tangent is a given value, denoted sin^{-1}, cos^{-1}, tan^{-1}.",trigonometry,trigonometry,8_Texts and Tests 4-Cut down.md
c97b5ebf-a60e-40cb-9259-2fcab746b409,recurrence relations,Definitions of sequences where each term is defined as a function of previous terms.,sequences and series,algebra,8_Texts and Tests 4-Cut down.md
26c63608-0af7-4649-bfa1-38da3de2bbd0,finite difference method,A method to identify the degree of a polynomial sequence by examining successive differences of terms.,sequences and series,algebra,8_Texts and Tests 4-Cut down.md
dac811cb-5004-4b1a-9e62-55c790717ecf,sigma notation for series,A concise notation using the summation symbol Σ to represent the sum of terms in a sequence.,sequences and series,algebra,8_Texts and Tests 4-Cut down.md
c6d53dc9-3592-46a0-b176-341c4777fc74,percentiles,"Values dividing a data set into 100 equal parts, indicating the relative standing of a data point.",data analysis,statistics,8_Texts and Tests 4-Cut down.md
1badfdcf-c660-490c-8aa2-b3078b135335,outliers,"Data points that are significantly different from other observations, affecting measures like mean and standard deviation.",data analysis,statistics,8_Texts and Tests 4-Cut down.md
5e3a1399-06ce-44df-9f6b-99ebf95bdd47,explanatory and response variables,"In experiments, the explanatory variable is controlled or manipulated, and the response variable is observed for changes.",statistical experiments,statistics,8_Texts and Tests 4-Cut down.md
7a4e9056-115a-4045-86d3-6ced1141170d,sampling methods,"Techniques for selecting representative samples from populations, including simple random, stratified, systematic, quota, cluster, and convenience sampling.",data collection,statistics,8_Texts and Tests 4-Cut down.md
938c6c10-a129-4cec-8f72-3b73e31417e0,"Basic geometry (points, lines, triangles)","Concept referenced in relationship: Basic geometry (points, lines, triangles)",Unknown,Unknown,8_Texts and Tests 4-Cut down.md
c581cc24-9467-45f4-8cab-c5f0be941d00,Using slope to determine parallel and perpendicular lines,Concept referenced in relationship: Using slope to determine parallel and perpendicular lines,Unknown,Unknown,8_Texts and Tests 4-Cut down.md
f313ee69-ca28-43cc-a0ad-15a00b579f30,"Concurrencies of a triangle (centroid, circumcentre, orthocentre)","Concept referenced in relationship: Concurrencies of a triangle (centroid, circumcentre, orthocentre)",Unknown,Unknown,8_Texts and Tests 4-Cut down.md
9cddbd51-856d-42bd-9cbc-619cbf803dd2,Solving cubic equations,Concept referenced in relationship: Solving cubic equations,Unknown,Unknown,8_Texts and Tests 4-Cut down.md
897ee97d-aa74-420b-b29c-b40ae1ea2db7,Algebraic surd equations,Concept referenced in relationship: Algebraic surd equations,Unknown,Unknown,8_Texts and Tests 4-Cut down.md
ab28733f-5c30-4ae1-9942-ca3983c620af,natural numbers,"The set of whole positive numbers starting from 1, i.e., {1, 2, 3, ...}.",Number Systems,Number Theory,9_Texts and tests 5- Cut down.md
c2fbbf00-9a0b-4779-8376-d573484d1376,integers,"The set of whole numbers including positive, negative numbers and zero, i.e., {..., -3, -2, -1, 0, 1, 2, 3, ...}.",Number Systems,Number Theory,9_Texts and tests 5- Cut down.md
1d6cbf82-2244-431d-9987-bfff73ce5e00,rational numbers,"Numbers that can be expressed as a ratio of two integers a/b where b ≠ 0, including fractions and decimals that terminate or repeat.",Number Systems,Number Theory,9_Texts and tests 5- Cut down.md
e1d83730-50ce-47c4-9306-14ca487ae4b0,irrational numbers,Real numbers that cannot be expressed as a ratio of two integers; their decimal expansions are non-terminating and non-repeating.,Number Systems,Number Theory,9_Texts and tests 5- Cut down.md
5f6a6735-b6b3-4107-bafe-8c620833dbef,surd simplification,"The process of expressing an irrational square root in simplest form by factoring out perfect squares, e.g., √18 = 3√2.",Number Systems,Radicals and Surds,9_Texts and tests 5- Cut down.md
58de2c12-ad6a-4d69-a6a4-9b1d2596c186,constructing line segment of length √2,Using compass and straightedge to construct a line segment on the number line whose length is the square root of 2.,Number Systems,Geometric Constructions,9_Texts and tests 5- Cut down.md
6dc75b3c-a074-4110-96ff-25ee07f95edc,constructing line segment of length √3,Using compass and straightedge to construct a line segment on the number line whose length is the square root of 3.,Number Systems,Geometric Constructions,9_Texts and tests 5- Cut down.md
aff95462-6393-4146-a3b6-b89e03d3090f,imaginary unit i,"The imaginary number defined as i = √(-1), used to extend the real number system to complex numbers.",Number Systems,Complex Numbers,9_Texts and tests 5- Cut down.md
5d6253f2-2e66-46f9-bce1-2f120029a02c,imaginary numbers,"Numbers of the form bi where b is a real number and i = √(-1), representing square roots of negative numbers.",Number Systems,Complex Numbers,9_Texts and tests 5- Cut down.md
9233e803-6115-452d-8177-8bdd000da389,subtraction of complex numbers,Subtracting complex numbers by separately subtracting their real parts and imaginary parts.,Number Systems,Complex Numbers,9_Texts and tests 5- Cut down.md
3757028e-3c80-4d8c-87fa-18799248aba2,division of complex numbers using conjugates,Dividing complex numbers by multiplying numerator and denominator by the conjugate of the denominator to rationalize it.,Number Systems,Complex Numbers,9_Texts and tests 5- Cut down.md
16c01c6d-e5b4-4c45-819b-557ba624fdbd,equality of complex numbers,Two complex numbers are equal if and only if their real parts are equal and their imaginary parts are equal.,Number Systems,Complex Numbers,9_Texts and tests 5- Cut down.md
74472f5f-573a-4d4e-b0b1-ae0a7671cc0a,powers of i,"The cyclic pattern of powers of i: i¹ = i, i² = -1, i³ = -i, i⁴ = 1, repeating every 4 powers.",Number Systems,Complex Numbers,9_Texts and tests 5- Cut down.md
d6ffa55f-a54b-4ad2-ba75-3bf8c3abc3e8,Argand diagram,A geometric representation of complex numbers as points in the plane with real part on x-axis and imaginary part on y-axis.,Number Systems,Complex Numbers,9_Texts and tests 5- Cut down.md
ddde991b-0d82-4f32-ad41-641d4c620855,geometric interpretation of complex addition,"Adding complex numbers corresponds to vector addition in the Argand plane, resulting in translation.",Number Systems,Complex Numbers,9_Texts and tests 5- Cut down.md
cd620e72-7ec2-4857-886b-120f281e07f8,geometric interpretation of multiplication by real scalar,Multiplying a complex number by a real number scales its modulus and stretches or contracts it from the origin.,Number Systems,Complex Numbers,9_Texts and tests 5- Cut down.md
0d324451-5e5c-4993-a416-a66dd96e2f70,geometric interpretation of multiplication by i,Multiplying a complex number by i corresponds to a rotation by 90 degrees counterclockwise about the origin in the Argand plane.,Number Systems,Complex Numbers,9_Texts and tests 5- Cut down.md
460dd370-961a-4845-88ff-bea8791e16e0,transformations of complex numbers,"Operations such as scaling, rotation, reflection, and translation represented by multiplication and addition of complex numbers.",Number Systems,Complex Numbers,9_Texts and tests 5- Cut down.md
e37a2223-e6c7-4a44-8fb2-4d2dff12dc59,conjugate roots theorem,"If a polynomial with real coefficients has a complex root z, then its conjugate z̄ is also a root.",Number Systems,Complex Numbers,9_Texts and tests 5- Cut down.md
eb960da6-c88b-476c-bb9a-2db04485fa0c,polar form of a complex number,"Representation of a complex number as z = r(cos θ + i sin θ), where r is modulus and θ is argument (angle).",Number Systems,Complex Numbers,9_Texts and tests 5- Cut down.md
4403b95f-4d0b-4010-bbc1-1559d527daee,argument of a complex number,The angle θ between the positive real axis and the line representing the complex number in the Argand plane.,Number Systems,Complex Numbers,9_Texts and tests 5- Cut down.md
68ba7529-82af-4142-bca2-0309285cecd5,conversion between rectangular and polar forms,"Using trigonometric relations: x = r cos θ, y = r sin θ, to convert between forms of complex numbers.",Number Systems,Complex Numbers,9_Texts and tests 5- Cut down.md
2501440a-cd96-4f75-8d40-17f17192c167,multiplication of complex numbers in polar form,Multiplying moduli and adding arguments: z₁z₂ = r₁r₂ [cos(θ₁ + θ₂) + i sin(θ₁ + θ₂)].,Number Systems,Complex Numbers,9_Texts and tests 5- Cut down.md
9cfc2141-5a9b-46fd-a2d5-d5d553f98fc1,division of complex numbers in polar form,Dividing moduli and subtracting arguments: z₁/z₂ = (r₁/r₂) [cos(θ₁ - θ₂) + i sin(θ₁ - θ₂)].,Number Systems,Complex Numbers,9_Texts and tests 5- Cut down.md
744114c6-1eb4-48dc-9ee5-732513b2d772,de Moivre's theorem,"For integer n, (cos θ + i sin θ)^n = cos nθ + i sin nθ, used to compute powers and roots of complex numbers.",Number Systems,Complex Numbers,9_Texts and tests 5- Cut down.md
6838d8e9-86a3-49c0-88c0-23c60899c4f2,nth roots of complex numbers using de Moivre's theorem,Finding nth roots by expressing complex number in polar form and applying de Moivre's theorem with general argument θ + 2πk.,Number Systems,Complex Numbers,9_Texts and tests 5- Cut down.md
962264a3-d291-4bef-93e8-757bfa350cd8,expressing trigonometric functions of multiple angles using de Moivre's theorem,Using de Moivre's theorem to express cos nθ and sin nθ in terms of powers of cos θ and sin θ.,Number Systems,Complex Numbers,9_Texts and tests 5- Cut down.md
bac4c1bb-2613-4bb6-92a9-85fb10105e93,irrational number,"A real number that cannot be expressed as a ratio of two integers, characterized by non-terminating, non-repeating decimal expansions.",Algebraic Concepts,Number Systems,9_Texts and tests 5- Cut down.md
24563a81-edc4-42d0-a496-32fd7d13eb3b,simplifying surds by factorization,The process of expressing a surd in simplest form by factoring out perfect squares from under the radical sign.,Algebraic Concepts,Radicals and Surds,9_Texts and tests 5- Cut down.md
86ab3a64-dec0-4cbc-8801-5bb60f1659e0,construction of line segment of length sqrt(2) using compass and straightedge,A geometric construction method to create a line segment of length √2 on the number line using perpendicular bisectors and arcs.,Algebraic Concepts,Geometric Constructions,9_Texts and tests 5- Cut down.md
6f10f71c-00c0-4278-8709-76157d161791,square root of a complex number in rectangular form,Expressing the square root of a complex number as a + bi by solving simultaneous equations derived from squaring a + bi.,Algebraic Concepts,Complex Numbers,9_Texts and tests 5- Cut down.md
eb293d3d-bf7a-4233-802d-39125cc0f072,geometric interpretation of complex number addition,"Adding complex numbers corresponds to vector addition in the Argand plane, resulting in translation.",Algebraic Concepts,Complex Numbers,9_Texts and tests 5- Cut down.md
5fe21569-2d61-4ee6-bd9d-08b8c388bf15,geometric interpretation of complex number multiplication by a real scalar,"Multiplying a complex number by a real number scales its modulus, resulting in stretching or contraction from the origin.",Algebraic Concepts,Complex Numbers,9_Texts and tests 5- Cut down.md
a99f0818-3359-4667-8dde-0b2e1ed987fd,geometric interpretation of complex number multiplication by i,Multiplying a complex number by i corresponds to a rotation of 90 degrees counterclockwise about the origin in the Argand plane.,Algebraic Concepts,Complex Numbers,9_Texts and tests 5- Cut down.md
a66a3f35-fa12-4430-b6b2-d14476cd0657,conversion between rectangular and polar forms of complex numbers,Using trigonometric relations to convert between x + iy and r(cos θ + i sin θ) forms.,Algebraic Concepts,Complex Numbers,9_Texts and tests 5- Cut down.md
d126c6db-fa58-44a8-96f8-876ad4a01e42,antidifferentiation (indefinite integration) of power functions,"Finding the general antiderivative of x^n as x^{n+1}/(n+1) + c, reversing differentiation.",Algebraic Concepts,Calculus - Integration,9_Texts and tests 5- Cut down.md
96fffbf2-f564-44e8-98c1-b8ddc654d045,constant of integration,An arbitrary constant added to the indefinite integral representing the family of antiderivatives.,Algebraic Concepts,Calculus - Integration,9_Texts and tests 5- Cut down.md
75cd04b5-9ae2-45a7-a59b-d3eef288ecbe,integration of exponential functions,Integrating e^{ax} as (1/a) e^{ax} + c and a^{x} as a^{x}/ln a + c.,Algebraic Concepts,Calculus - Integration,9_Texts and tests 5- Cut down.md
aa70303d-3c8a-4811-9a65-bb2e26781471,integration of trigonometric functions,Integrals of sin(ax) and cos(ax) as -cos(ax)/a + c and sin(ax)/a + c respectively.,Algebraic Concepts,Calculus - Integration,9_Texts and tests 5- Cut down.md
f9a32f97-cfaf-4391-856d-3e56e557a224,application of integration to kinematics,Using integration to find velocity from acceleration and displacement from velocity functions.,Algebraic Concepts,Calculus - Applications,9_Texts and tests 5- Cut down.md
89859663-efd6-4bc6-9b56-b0c9db0880d6,definite integral as area under a curve,Calculating the exact area between a curve and the x-axis over an interval using definite integrals.,Algebraic Concepts,Calculus - Integration,9_Texts and tests 5- Cut down.md
db0f5094-4f12-4c4e-9880-85aac9490955,area between two curves,Finding the area enclosed between two curves by integrating the difference of their functions over the interval.,Algebraic Concepts,Calculus - Integration,9_Texts and tests 5- Cut down.md
4bc76a25-1d18-43b3-a1c5-5337e582efa1,average value of a function over an interval,"The average value of f(x) over [a,b] is (1/(b−a)) ∫_a^b f(x) dx, representing the height of a rectangle with equal area.",Algebraic Concepts,Calculus - Applications,9_Texts and tests 5- Cut down.md
eb7c5df5-4b09-49d4-a989-79e99ca75f25,rate of change,"The derivative representing the instantaneous rate of change of one quantity with respect to another, often time.",Algebraic Concepts,Calculus - Differential Calculus,9_Texts and tests 5- Cut down.md
633b4aa3-8b9f-4b8e-9c05-dc38b5c53dba,related rates of change,Using the chain rule to relate rates of change of related variables with respect to time.,Algebraic Concepts,Calculus - Applications,9_Texts and tests 5- Cut down.md
d394a448-34fc-4317-8013-d3d0c6294462,compound interest formula,Calculating the final amount F = P(1 + i)^t for principal P invested at interest rate i for t periods.,Algebraic Concepts,Financial Mathematics,9_Texts and tests 5- Cut down.md
9608c2d6-6a15-40b9-a3ad-222033b09a38,present value formula,Calculating the present value as PV = F / (1 + i)^t for future amount F discounted at rate i over t periods.,Algebraic Concepts,Financial Mathematics,9_Texts and tests 5- Cut down.md
53fb28c4-872b-45a6-975b-178af593e8da,reducing balance depreciation,Depreciation method where the asset value decreases by a fixed percentage each period: F = P(1 - i)^t.,Algebraic Concepts,Financial Mathematics,9_Texts and tests 5- Cut down.md
96287a19-17aa-4fbc-9717-76f3a8c018d8,instalment savings (annuities) final value formula,Sum of geometric series representing accumulated value of regular payments: F = P(1+i)[(1+i)^t - 1]/i.,Algebraic Concepts,Financial Mathematics,9_Texts and tests 5- Cut down.md
13ea3ef2-fae7-49a7-a94f-adfc3d8ea4f0,pension present value formula,Present value of a series of future payments: PV = P/(1+i) * [1 - (1/(1+i))^t] / [1 - 1/(1+i)].,Algebraic Concepts,Financial Mathematics,9_Texts and tests 5- Cut down.md
34a29f02-3d3e-4f86-9604-d67241c0408a,loan repayment formula,"Monthly repayment A = P * [i(1+i)^t] / [(1+i)^t - 1] for loan amount P, interest rate i, and t payments.",Algebraic Concepts,Financial Mathematics,9_Texts and tests 5- Cut down.md
78a05b5e-47c5-4c5e-b542-6bd95f4c8d22,tree diagram for probability,A branching diagram representing all possible outcomes of sequential events with associated probabilities.,Algebraic Concepts,Probability,9_Texts and tests 5- Cut down.md
6118e4de-1009-49db-838d-1744376e6ca4,probability distribution of a discrete random variable,A table or function listing possible values of a discrete random variable and their associated probabilities.,Algebraic Concepts,Probability,9_Texts and tests 5- Cut down.md
4ad2c9da-e5e6-452b-b29f-2aa8b169c239,expected value of a discrete random variable,"The weighted average of all possible values of the variable, calculated as sum of x * P(x).",Algebraic Concepts,Probability,9_Texts and tests 5- Cut down.md
91d6b042-15b7-47b4-a4e2-dd8e46836e94,binomial distribution probability formula,"Probability of r successes in n independent Bernoulli trials: P(r) = C(n,r) p^r q^{n-r}.",Algebraic Concepts,Probability,9_Texts and tests 5- Cut down.md
0f5101dd-3310-4f27-adf0-1fe55736954c,conversion between rectangular and polar form of complex numbers,Using trigonometric relations to convert between a + bi and r(cos θ + i sin θ).,Operations,Complex Numbers,9_Texts and tests 5- Cut down.md
4148ecc3-a963-4d58-85fb-9a7e43ac3a06,simplifying expressions of the form (cos θ - i sin θ)^n,Using the identity cos θ - i sin θ = cos(-θ) + i sin(-θ) and applying de Moivre's theorem accordingly.,Operations,Complex Numbers,9_Texts and tests 5- Cut down.md
