id,name,explanation,broader_concept,strand,source
e1399278-a299-420f-b277-2527e5f7c223,generalisation of patterns using algebraic notation,Expressing observed numerical or object patterns in symbolic algebraic form to describe the pattern rule.,Algebraic Concepts,Algebra,1_Curriculum csvs - Number.csv
d0ff213d-8852-4645-ab2c-7105d6a6c8ba,proof by induction of simple identities,A method of mathematical proof used to establish the truth of identities such as sums of sequences by proving a base case and an inductive step.,Algebraic Concepts,Proof and Reasoning,1_Curriculum csvs - Number.csv
0e90050c-863d-4b87-9ef9-4085b703cf14,proof by induction of simple inequalities,"Using mathematical induction to prove inequalities involving natural numbers, such as factorial and exponential inequalities.",Algebraic Concepts,Proof and Reasoning,1_Curriculum csvs - Number.csv
c9eed26b-6629-45d6-85ab-512f9b29338c,factorisation of algebraic expressions,Rewriting algebraic expressions as products of simpler expressions or factors.,Algebraic Concepts,Algebra,1_Curriculum csvs - Number.csv
15a09654-fa4c-459b-bb15-863e47863611,expressing numbers in prime factorisation form,Representing a number as a product of prime numbers raised to powers.,Algebraic Concepts,Number Theory,1_Curriculum csvs - Number.csv
d9488dd2-bf30-4969-8a8f-75b80d56b68e,expressing numbers in scientific notation,Writing non-zero positive rational numbers in the form a × 10^n where 1 ≤ a < 10 and n is an integer.,Algebraic Concepts,Number Systems,1_Curriculum csvs - Number.csv
df4ba9ab-8cd1-465e-bb10-6b6a6e6c4009,operations on numbers in scientific notation,Performing arithmetic operations such as multiplication and division on numbers expressed in scientific notation.,Algebraic Concepts,Number Systems,1_Curriculum csvs - Number.csv
d79b4c14-8461-435a-8212-edd2b3dfdcde,rules of indices (exponents),"Laws governing the manipulation of powers, including product, quotient, power of a power, zero, negative, and fractional exponents.",Algebraic Concepts,Indices and Logarithms,1_Curriculum csvs - Number.csv
7fa1675e-8df3-4171-ad86-4c16854d11fe,rules of logarithms,"Properties of logarithms including product, quotient, power rules, and change of base formula.",Algebraic Concepts,Indices and Logarithms,1_Curriculum csvs - Number.csv
9b400c01-400b-40f1-94a2-9af971fd438c,complex numbers in rectangular form,"Representation of complex numbers as a + ib, where a and b are real numbers and i is the imaginary unit.",Algebraic Concepts,Complex Numbers,1_Curriculum csvs - Number.csv
2cacc143-215c-4788-8b4a-f22c8ebb0bac,geometric construction of irrational numbers,Using geometric methods to construct lengths representing irrational numbers such as √2 and √3.,Algebraic Concepts,Number Systems,1_Curriculum csvs - Number.csv
5ecc6500-d918-4f43-a252-547e293c282f,proof of irrationality of √2,A mathematical proof demonstrating that √2 cannot be expressed as a ratio of two integers.,Algebraic Concepts,Number Theory,1_Curriculum csvs - Number.csv
076114e9-013f-45fb-971f-d02956d75d63,verification and justification of formulae from number patterns,Using algebraic reasoning to confirm and explain formulae derived from observed numerical patterns.,Algebraic Concepts,Algebra,1_Curriculum csvs - Number.csv
02efeb52-9717-4f0f-b418-3b8af003952e,net of a rectangular solid,A two-dimensional pattern that can be folded to form the surface of a rectangular solid.,Geometric Concepts,"Length, area and volume",1_Curriculum csvs - Number.csv
03c37f4a-c3a9-40dd-86ba-140711d14757,net of a cylinder,A two-dimensional pattern consisting of two circles and a rectangle that can be folded to form a cylinder.,Geometric Concepts,"Length, area and volume",1_Curriculum csvs - Number.csv
2430fdde-58b0-4b30-8b34-62c856904f66,net of a prism,"A two-dimensional pattern that can be folded to form the surface of a prism, including triangular-based prisms.",Geometric Concepts,"Length, area and volume",1_Curriculum csvs - Number.csv
0f065382-d579-4332-955c-c9c521d1cc85,net of a cone,A two-dimensional pattern consisting of a sector of a circle and a circle that can be folded to form a cone.,Geometric Concepts,"Length, area and volume",1_Curriculum csvs - Number.csv
b0037ba7-cac3-4fa4-9854-21744c807a06,perimeter of a disc,"The length of the boundary of a circular shape, also known as the circumference.",Geometric Concepts,"Length, area and volume",1_Curriculum csvs - Number.csv
8aff6d25-a029-411f-9336-8dbeae8e5266,perimeter of a triangle,The total length of the three sides of a triangle.,Geometric Concepts,"Length, area and volume",1_Curriculum csvs - Number.csv
3f2939e5-7fed-4c5e-84fb-5dfa42773c48,perimeter of a rectangle,The total length of all four sides of a rectangle.,Geometric Concepts,"Length, area and volume",1_Curriculum csvs - Number.csv
dadb9fd0-0c0b-46b7-96d5-b87fa7d12eb5,perimeter of a square,The total length of all four equal sides of a square.,Geometric Concepts,"Length, area and volume",1_Curriculum csvs - Number.csv
755b0333-3baf-40c6-ad89-ad284692709b,perimeter of a parallelogram,The total length of all four sides of a parallelogram.,Geometric Concepts,"Length, area and volume",1_Curriculum csvs - Number.csv
bde90b78-6425-4f1b-b26c-58666ae7e496,perimeter of a trapezium,The total length of all four sides of a trapezium (trapezoid).,Geometric Concepts,"Length, area and volume",1_Curriculum csvs - Number.csv
5dead4e0-2448-4b09-b0d9-d9ef9b0b9792,area of a disc,The measure of the space enclosed within the boundary of a circle.,Geometric Concepts,"Length, area and volume",1_Curriculum csvs - Number.csv
415a9611-7969-41a0-ad69-6aaff9c3a4a7,area of a triangle,"The measure of the space enclosed within a triangle, calculated using base and height or other formulas.",Geometric Concepts,"Length, area and volume",1_Curriculum csvs - Number.csv
e991a2a0-7e35-4682-bb63-f8515f7f81eb,area of a rectangle,"The measure of the space enclosed within a rectangle, calculated as length multiplied by width.",Geometric Concepts,"Length, area and volume",1_Curriculum csvs - Number.csv
894d33f3-d07b-45d9-a1c6-ede4f7a313f9,area of a square,"The measure of the space enclosed within a square, calculated as the side length squared.",Geometric Concepts,"Length, area and volume",1_Curriculum csvs - Number.csv
360fd7fa-971a-4704-8804-70fd125de8b2,area of a parallelogram,"The measure of the space enclosed within a parallelogram, calculated as base times height.",Geometric Concepts,"Length, area and volume",1_Curriculum csvs - Number.csv
cfa597a7-9d12-4d4c-8e68-13da29807d8f,area of a trapezium,"The measure of the space enclosed within a trapezium, calculated as half the sum of parallel sides times the height.",Geometric Concepts,"Length, area and volume",1_Curriculum csvs - Number.csv
09090046-6a14-41d5-b63d-77d42112f3af,area of a sector of a disc,"The measure of the space enclosed within a sector (a 'slice') of a circle, proportional to the angle of the sector.",Geometric Concepts,"Length, area and volume",1_Curriculum csvs - Number.csv
2b8be1cd-b451-41b8-949f-be4262b6d0bd,area estimation of irregular shapes,"Techniques to approximate the area of shapes that do not have standard geometric formulas, often by decomposition or approximation.",Geometric Concepts,"Length, area and volume",1_Curriculum csvs - Number.csv
f053517a-fefb-4ba1-be09-af2e4b84ba86,volume of a rectangular solid,"The measure of the space occupied by a rectangular solid, calculated as length × width × height.",Geometric Concepts,"Length, area and volume",1_Curriculum csvs - Number.csv
651c002b-acd3-4cf1-9488-20804942e0a7,volume of a cylinder,"The measure of the space occupied by a cylinder, calculated as the area of the base circle times the height.",Geometric Concepts,"Length, area and volume",1_Curriculum csvs - Number.csv
d977d09f-e97a-477e-9b99-64878b84a3a9,volume of a sphere,"The measure of the space occupied by a sphere, calculated using the formula 4/3 π r³.",Geometric Concepts,"Length, area and volume",1_Curriculum csvs - Number.csv
a80c110f-a18c-49f6-b1bf-6c8df1ae6ba2,volume of a hemisphere,"The measure of the space occupied by half a sphere, calculated as half the volume of a sphere.",Geometric Concepts,"Length, area and volume",1_Curriculum csvs - Number.csv
9ac11e6b-a451-4e75-ab47-6c3eb9667d02,volume of a right cone,"The measure of the space occupied by a right circular cone, calculated as one-third the area of the base times the height.",Geometric Concepts,"Length, area and volume",1_Curriculum csvs - Number.csv
e9d31478-bec8-4f04-8d5d-8fb40a69366c,volume of a triangular-based prism,"The measure of the space occupied by a prism with a triangular base, calculated as the area of the triangular base times the length of the prism.",Geometric Concepts,"Length, area and volume",1_Curriculum csvs - Number.csv
294a48eb-f029-4303-93e7-966ffedc8935,surface area of a rectangular solid,The total area of all the faces of a rectangular solid.,Geometric Concepts,"Length, area and volume",1_Curriculum csvs - Number.csv
2273643b-355a-4de0-a763-905815bd5af0,surface area of a cylinder,The total area of the curved surface and the two circular bases of a cylinder.,Geometric Concepts,"Length, area and volume",1_Curriculum csvs - Number.csv
24bed581-dd06-437b-b4af-b8519d0e7a5e,surface area of a sphere,"The total area covering the surface of a sphere, calculated as 4 π r².",Geometric Concepts,"Length, area and volume",1_Curriculum csvs - Number.csv
90ff948d-b7fc-4b5a-a97c-a90de65e8929,surface area of a hemisphere,The total area covering the curved surface and the base of a hemisphere.,Geometric Concepts,"Length, area and volume",1_Curriculum csvs - Number.csv
4e01f5b5-885d-47b5-910f-910e0e8157c0,surface area of a right cone,The total area of the curved surface and the base of a right circular cone.,Geometric Concepts,"Length, area and volume",1_Curriculum csvs - Number.csv
26f954a5-e91f-435c-940f-53be3ff75524,surface area of a triangular-based prism,The total area of all faces of a prism with a triangular base.,Geometric Concepts,"Length, area and volume",1_Curriculum csvs - Number.csv
d6a5711a-10c2-4bea-9e10-8821c57c3240,trapezoidal rule for area approximation,A numerical method to approximate the area under a curve by dividing it into trapezoids and summing their areas.,Geometric Concepts,"Length, area and volume",1_Curriculum csvs - Number.csv
418e9b80-6049-40e9-91b2-377b1a3f4a99,relationship between circumference and diameter of a circle,"The constant ratio of the circumference of a circle to its diameter, known as π (pi).",Geometric Concepts,"Length, area and volume",1_Curriculum csvs - Number.csv
bb10c78a-c229-4048-b3a9-d673e96bfaf3,drawing and interpreting scaled diagrams,Creating and understanding diagrams where all lengths are proportionally reduced or enlarged by a scale factor.,Geometric Concepts,"Length, area and volume",1_Curriculum csvs - Number.csv
558553cd-49b4-4a32-b08a-e58d66e64f8b,percentage calculation,"Calculating the percentage value of a quantity, including finding a percentage of a number and converting between fractions, decimals, and percentages.",Data Analysis,Number Systems / Arithmetic,1_Curriculum csvs - Number.csv
73af1883-392c-4928-b7cd-f93610ab81c6,percentage profit and loss calculation,"Determining profit or loss as a percentage of the cost price, including calculating selling price, discount, and mark up.",Data Analysis,Arithmetic / Financial Mathematics,1_Curriculum csvs - Number.csv
eddebab7-1c29-429b-9db3-9303cf8752a8,compound interest calculation (up to 3 years),Calculating the amount of compound interest accrued on an investment or loan over a period not exceeding three years.,Data Analysis,Financial Mathematics,1_Curriculum csvs - Number.csv
a2318557-c88b-4c48-80d9-91516c41b130,income tax calculation (standard rate only),Computing income tax payable at a standard rate based on given income and deductions.,Data Analysis,Financial Mathematics,1_Curriculum csvs - Number.csv
f05a77de-08bb-4442-ad74-c87cb7bf111f,net pay calculation including deductions,Calculating the net pay of an individual after subtracting specified deductions such as taxes and other contributions.,Data Analysis,Financial Mathematics,1_Curriculum csvs - Number.csv
db2abeac-fafd-4549-9ebd-893e39598300,ratio and proportion problem solving,Using the equivalence of ratios and proportions to solve problems involving comparison and scaling of quantities.,Data Analysis,Arithmetic / Number Systems,1_Curriculum csvs - Number.csv
bf7a5e1e-f50d-4d2a-ba68-9cf5b9b66b4f,rounding numerical results,Rounding numerical answers to a specified degree of accuracy or decimal place.,Data Analysis,Arithmetic,1_Curriculum csvs - Number.csv
d1f0f48b-5512-4627-9c54-74467dd28eb6,checking results by working backwards,Verifying the correctness of a solution by reversing the steps of the calculation.,Data Analysis,Arithmetic / Problem Solving,1_Curriculum csvs - Number.csv
0ffe9106-83bf-4c0d-8476-c1c5cf2c9baf,calculating average speed from distance and time,Determining average speed by dividing total distance traveled by total time taken.,Data Analysis,Measurement / Arithmetic,1_Curriculum csvs - Number.csv
36eb05a0-bf43-45a7-881b-736173ab403a,calculating distance from average speed and time,Finding the distance traveled by multiplying average speed by time.,Data Analysis,Measurement / Arithmetic,1_Curriculum csvs - Number.csv
dccf5f32-ca6d-49e8-93df-c0fc9959c1f3,calculating time from distance and average speed,Determining the time taken by dividing distance by average speed.,Data Analysis,Measurement / Arithmetic,1_Curriculum csvs - Number.csv
86c9ea55-1ade-4902-9a87-8c86d1ed16f9,calculating percentage error,Computing the percentage difference between an approximate or measured value and the exact or true value.,Data Analysis,Measurement / Arithmetic,1_Curriculum csvs - Number.csv
9d1d7286-2573-47d7-b32c-291fa586035a,calculating tolerance in measurements,Determining the allowable deviation from a specified measurement value.,Data Analysis,Measurement,1_Curriculum csvs - Number.csv
87be450e-457e-48df-8b81-018e939289ce,accumulating error by addition or subtraction,Understanding how errors in measurements or calculations combine when quantities are added or subtracted.,Data Analysis,Measurement / Arithmetic,1_Curriculum csvs - Number.csv
1b0d63ce-e11b-4b35-9207-9ab4f5c74a8f,using present value in loan repayments and investments,Calculating the current worth of a future sum of money or stream of cash flows given a specified rate of return.,Data Analysis,Financial Mathematics,1_Curriculum csvs - Number.csv
cbd8f492-aa41-4719-8e43-c7825a730a66,Equation solving and manipulation,Techniques and processes used to find values of variables that satisfy algebraic equations.,Algebra,Algebra,1_Curriculum csvs - Number.csv
c2ba6329-844f-4150-a2e3-3b5b354aa98b,Limits of sequences,The value that the terms of a sequence approach as the index goes to infinity.,Sequences and series,Number systems / Analysis,1_Curriculum csvs - Number.csv
99014588-63b0-423d-a841-39865d031e30,Financial mathematics applications,"Applying mathematical concepts such as compound interest, income tax, net pay, and mortgage repayments to real-world financial problems.",Applied mathematics,Arithmetic / Number systems,1_Curriculum csvs - Number.csv
bb147d16-8dcd-4d9f-93c4-cfce4c741c04,Depreciation (reducing balance method),Calculating the decrease in value of an asset over time using a fixed percentage rate applied to the reducing balance.,Financial mathematics,Arithmetic / Number systems,1_Curriculum csvs - Number.csv
3655c5eb-2843-41c3-8b0e-274d04ccfa8b,Metric and imperial unit conversions,Converting measurements between metric and imperial units using conversion factors.,Measurement,Measurement and Geometry,1_Curriculum csvs - Number.csv
1ad8f066-e71f-4628-a679-8ec84f3ce9dd,"Costing including materials, labour, and wastage","Calculating total cost by considering costs of materials, labour, and wastage in production or projects.",Applied arithmetic,Arithmetic / Number systems,1_Curriculum csvs - Number.csv
41dd605b-df07-4f76-8ea2-4b85b0a12610,Average rate of change,"Calculating the average rate at which a quantity changes with respect to another variable, often time.",Rates and ratios,Arithmetic / Number systems,1_Curriculum csvs - Number.csv
e9158192-c778-4fba-b059-94e9188f03cc,polynomial expression,An algebraic expression formed by the addition of terms with variables raised to positive integer powers and coefficients.,Algebraic Concepts,Polynomials,8_Texts and Tests 4-Cut down.md
16238dc8-d114-4ce4-ad37-5f7c532126b3,binomial expression,A polynomial expression containing exactly two terms.,Algebraic Concepts,Polynomials,8_Texts and Tests 4-Cut down.md
ec6a97eb-9bbb-4830-ac6a-adeddc8c8ebd,trinomial expression,A polynomial expression containing exactly three terms.,Algebraic Concepts,Polynomials,8_Texts and Tests 4-Cut down.md
43759c86-7a8c-4f4d-8b5c-f7aa49eff8cd,degree of a polynomial,The highest power of the variable in a polynomial expression.,Algebraic Concepts,Polynomials,8_Texts and Tests 4-Cut down.md
b65971b7-b83c-40e0-a022-c99fb05ac0f6,coefficient of a term in a polynomial,The numerical factor multiplying the variable term in a polynomial expression.,Algebraic Concepts,Polynomials,8_Texts and Tests 4-Cut down.md
22bd9655-5903-44bd-9135-db5169a4bf55,addition and subtraction of polynomial expressions,Combining like terms by adding or subtracting their coefficients.,Algebraic Concepts,Polynomials,8_Texts and Tests 4-Cut down.md
bc0c620f-8317-4cbd-bc7b-68e09ce62cac,multiplying polynomial expressions (expanding),Using the distributive law to multiply polynomials by multiplying each term in one polynomial by each term in the other.,Algebraic Concepts,Polynomials,8_Texts and Tests 4-Cut down.md
9165b1a2-8405-46f4-84ef-b1f6c67e077d,perfect square polynomial,"A polynomial that can be expressed as the square of a binomial, e.g., (x + a)^2 = x^2 + 2ax + a^2.",Algebraic Concepts,Polynomials,8_Texts and Tests 4-Cut down.md
b4382e58-38d9-432b-a159-c707ce870585,difference of two squares,A binomial expression of the form a^2 - b^2 which factors as (a - b)(a + b).,Algebraic Concepts,Polynomials,8_Texts and Tests 4-Cut down.md
059e9c90-b53f-4f24-8d85-a18fd58c5c51,dividing algebraic expressions by a monomial,Dividing each term of the numerator polynomial by the monomial denominator.,Algebraic Concepts,Polynomials,8_Texts and Tests 4-Cut down.md
8a0bb599-0968-45a1-913d-afa86173c045,dividing algebraic expressions by a polynomial factor,"Dividing a polynomial numerator by a polynomial denominator that is a factor, simplifying the expression.",Algebraic Concepts,Polynomials,8_Texts and Tests 4-Cut down.md
40cecc68-7b9e-4101-96dd-0daec239aecb,polynomial long division,"A method to divide polynomials when the denominator is not a factor, similar to numerical long division.",Algebraic Concepts,Polynomials,8_Texts and Tests 4-Cut down.md
60add219-2922-461e-aa0d-aa75182e9257,polynomial function,"A function defined by a polynomial expression, where the output depends on the input variable.",Algebraic Concepts,Functions,8_Texts and Tests 4-Cut down.md
77f819b6-2fdb-4263-9f1c-769d347eb2f8,evaluating polynomial functions,Calculating the value of a polynomial function by substituting a given value for the variable and simplifying.,Algebraic Concepts,Functions,8_Texts and Tests 4-Cut down.md
909f171b-4107-418e-82ac-de4b0ba6631e,finding the domain restrictions of polynomial functions,"Determining the set of input values for which the polynomial function is defined, e.g., ensuring denominators are non-zero.",Algebraic Concepts,Functions,8_Texts and Tests 4-Cut down.md
5d90e668-4b07-4f5d-8dab-02232ae048a7,finding the volume and surface area functions of geometric solids,"Expressing volume and surface area as polynomial functions of dimensions, e.g., box dimensions depending on variable x.",Algebraic Concepts,Functions,8_Texts and Tests 4-Cut down.md
12502141-e120-4c71-9d11-79ba0b3775e0,factorising algebraic expressions by highest common factor,Extracting the greatest common monomial factor from all terms of an algebraic expression.,Algebraic Concepts,Factorisation,8_Texts and Tests 4-Cut down.md
c0eda823-9782-43d2-8bf4-903c4f386e3e,factorising by grouping,Grouping terms in pairs or sets to factor out common factors and then factorising the resulting expression.,Algebraic Concepts,Factorisation,8_Texts and Tests 4-Cut down.md
afa2ea34-f589-45ba-a693-e569f49e3b59,factorising difference of two squares,Expressing a^2 - b^2 as (a - b)(a + b).,Algebraic Concepts,Factorisation,8_Texts and Tests 4-Cut down.md
fd48bff3-3b79-4a25-9825-843864237ec5,factorising quadratic expressions by trial and error,Finding two binomial factors of a quadratic expression by testing factor pairs of the constant term.,Algebraic Concepts,Factorisation,8_Texts and Tests 4-Cut down.md
99e649fd-b3c0-43b8-93f9-ffd408795a4d,factorising quadratic expressions using the quadratic formula,Using the roots found by the quadratic formula to write the quadratic as a product of two linear factors.,Algebraic Concepts,Factorisation,8_Texts and Tests 4-Cut down.md
fa7501ee-3b24-44f6-986d-1e6e6d4af139,factorising sum and difference of cubes,Expressing x^3 - y^3 as (x - y)(x^2 + xy + y^2) and x^3 + y^3 as (x + y)(x^2 - xy + y^2).,Algebraic Concepts,Factorisation,8_Texts and Tests 4-Cut down.md
8fb24281-18e8-4f2a-8d02-0cfd02518d9e,simplifying algebraic fractions,Reducing algebraic fractions by factorising numerator and denominator and cancelling common factors.,Algebraic Concepts,Algebraic Fractions,8_Texts and Tests 4-Cut down.md
608d431c-6e79-472f-8ea6-92f1aa7cb55d,adding and subtracting algebraic fractions,Finding a common denominator and combining numerators accordingly.,Algebraic Concepts,Algebraic Fractions,8_Texts and Tests 4-Cut down.md
fc56fa33-6c21-4aa1-8541-432b0191cae8,multiplying and dividing algebraic fractions,Multiplying numerators and denominators separately; dividing by multiplying by reciprocal.,Algebraic Concepts,Algebraic Fractions,8_Texts and Tests 4-Cut down.md
167c9e2e-fbf0-4e79-bd1f-78130a4c5f93,binomial expansion using Pascal's triangle,Expanding (a + b)^n using coefficients from Pascal's triangle and powers of a and b.,Algebraic Concepts,Binomial Theorem,8_Texts and Tests 4-Cut down.md
151ff225-a474-443a-afcb-c95b4d9572fe,binomial theorem general term,"The r-th term in the expansion of (a + b)^n is given by C(n, r) a^{n-r} b^r.",Algebraic Concepts,Binomial Theorem,8_Texts and Tests 4-Cut down.md
93ec1d59-4bcb-4685-a77a-e5221a93dafc,algebraic identities,"Equations true for all values of the variable, often used to find unknown coefficients or simplify expressions.",Algebraic Concepts,Identities,8_Texts and Tests 4-Cut down.md
f140ad4a-3336-4245-82d1-69f51a39b88d,partial fraction decomposition using algebraic identities,Expressing a rational function as a sum of simpler fractions using algebraic identities and solving for unknown coefficients.,Algebraic Concepts,Identities,8_Texts and Tests 4-Cut down.md
4d1a8049-5f1d-469e-bf80-35c5103dd283,manipulating formulae to make a variable the subject,Rearranging equations to express one variable explicitly in terms of others.,Algebraic Concepts,Manipulating Formulae,8_Texts and Tests 4-Cut down.md
cbe1fe0f-5a3e-4b6e-9a09-543817bb1399,solving linear equations,Finding the value(s) of the variable(s) that satisfy a linear equation.,Algebraic Concepts,Equations,8_Texts and Tests 4-Cut down.md
668348bd-87ad-41a0-8c8e-b850f7a75bfe,solving quadratic equations by factorisation,Solving quadratic equations by expressing them as a product of factors equal to zero and finding roots.,Algebraic Concepts,Equations,8_Texts and Tests 4-Cut down.md
adb89cca-0046-4d9b-9f5b-1c3ae6f3bcf4,solving quadratic equations by quadratic formula,Using the quadratic formula to find roots of any quadratic equation.,Algebraic Concepts,Equations,8_Texts and Tests 4-Cut down.md
a77b0341-d092-4e57-9a63-4da72f7676b3,solving quadratic equations by substitution,Using substitution to reduce complex equations to quadratic form and then solving.,Algebraic Concepts,Equations,8_Texts and Tests 4-Cut down.md
4ec2ff51-9f65-4872-a538-8dd53e4ce119,discriminant and nature of quadratic roots,"Using the discriminant b^2 - 4ac to determine whether roots are real distinct, real equal, or complex.",Algebraic Concepts,Quadratics,8_Texts and Tests 4-Cut down.md
c7f49dff-8d5f-4623-98d7-62b6baf718a2,forming quadratic equations from roots,Constructing a quadratic equation given its roots using the relation x^2 - (sum of roots)x + product of roots = 0.,Algebraic Concepts,Quadratics,8_Texts and Tests 4-Cut down.md
2cedaa6e-9524-4ffa-80c0-bc4f8ff5e313,completing the square,"Rewriting a quadratic expression in the form a(x - p)^2 + q to find vertex, minimum/maximum values, and solve equations.",Algebraic Concepts,Quadratics,8_Texts and Tests 4-Cut down.md
8be2b550-4ef1-473b-b366-5cfff56c8861,simplifying surds,Reducing square roots to simplest form by factoring out perfect squares and rationalising denominators.,Algebraic Concepts,Surds,8_Texts and Tests 4-Cut down.md
ce84db83-60af-434b-9ad2-cbd41c53933c,distance formula between two points in coordinate plane,"Calculates the length of the line segment between two points (x1, y1) and (x2, y2) using the formula sqrt((x2 - x1)^2 + (y2 - y1)^2).",Geometric Concepts,Coordinate Geometry: The Line,8_Texts and Tests 4-Cut down.md
319baf34-fc49-4ff1-8059-f490e7d2bf43,midpoint formula of a line segment,"Finds the point exactly halfway between two points (x1, y1) and (x2, y2) using the formula ((x1 + x2)/2, (y1 + y2)/2).",Geometric Concepts,Coordinate Geometry: The Line,8_Texts and Tests 4-Cut down.md
520bf5c6-e019-4f65-ae79-65f49a564570,slope of a line segment,"Measures the steepness or incline of a line segment between two points, calculated as (y2 - y1) / (x2 - x1).",Geometric Concepts,Coordinate Geometry: The Line,8_Texts and Tests 4-Cut down.md
