id,name,explanation,broader_concept,strand,source
d7536fca-2b50-4221-bb50-f4899a6ff761,Pythagorean trigonometric identity,The fundamental identity cos²A + sin²A = 1 relating the squares of sine and cosine of the same angle.,Algebraic Concepts,Trigonometry,7_Leaving Cert Maths-Trig_Formulae.pdf
5ea034a5-e238-4452-bdac-c5d1346711a1,Sine rule for triangles,The formula relating the sides and angles of a triangle: a/sin A = b/sin B = c/sin C.,Algebraic Concepts,Trigonometry,7_Leaving Cert Maths-Trig_Formulae.pdf
fe3c47a0-a628-40cd-a0fe-664539c289cc,Cosine rule for triangles,The formula a² = b² + c² – 2bc cos A relating the lengths of sides of a triangle to the cosine of one angle.,Algebraic Concepts,Trigonometry,7_Leaving Cert Maths-Trig_Formulae.pdf
a1d3c5e5-ef56-4744-ad18-690c0ee27240,Cosine of difference formula,The formula cos(A–B) = cos A cos B + sin A sin B expressing cosine of a difference of angles in terms of sines and cosines.,Algebraic Concepts,Trigonometric identities,7_Leaving Cert Maths-Trig_Formulae.pdf
71ea3891-66ba-4b2b-a454-56b4a969dae9,Cosine of sum formula,The formula cos(A+B) = cos A cos B – sin A sin B expressing cosine of a sum of angles in terms of sines and cosines.,Algebraic Concepts,Trigonometric identities,7_Leaving Cert Maths-Trig_Formulae.pdf
cea0023e-cc29-46e5-8899-59ac3a9207f5,Double angle formula for cosine,The formula cos 2A = cos² A – sin² A expressing cosine of double an angle in terms of squares of sine and cosine.,Algebraic Concepts,Trigonometric identities,7_Leaving Cert Maths-Trig_Formulae.pdf
63d018f2-0594-4e6e-9fc6-fe2354470236,Sine of sum formula,The formula sin(A+B) = sin A cos B + cos A sin B expressing sine of a sum of angles in terms of sines and cosines.,Algebraic Concepts,Trigonometric identities,7_Leaving Cert Maths-Trig_Formulae.pdf
b70c0a42-66b5-4e24-8cce-c78510c933f3,Sine of difference formula,The formula sin(A–B) = sin A cos B – cos A sin B expressing sine of a difference of angles in terms of sines and cosines.,Algebraic Concepts,Trigonometric identities,7_Leaving Cert Maths-Trig_Formulae.pdf
7a0b0c7b-7ec6-491c-b713-41b71b8e1fa8,Tangent of sum formula,The formula tan(A+B) = (tan A + tan B) / (1 – tan A tan B) expressing tangent of a sum of angles in terms of tangents.,Algebraic Concepts,Trigonometric identities,7_Leaving Cert Maths-Trig_Formulae.pdf
82d86dcd-3d22-47fc-84fb-a03a57b5fcac,Tangent of difference formula,The formula tan(A–B) = (tan A – tan B) / (1 + tan A tan B) expressing tangent of a difference of angles in terms of tangents.,Algebraic Concepts,Trigonometric identities,7_Leaving Cert Maths-Trig_Formulae.pdf
b29440d0-1684-4be0-adcd-c3b049613401,Double angle formula for sine,The formula sin 2A = 2 sin A cos A expressing sine of double an angle in terms of sine and cosine.,Algebraic Concepts,Trigonometric identities,7_Leaving Cert Maths-Trig_Formulae.pdf
8af37dde-dfc4-4e8a-abd6-576c8d7081f0,Alternative double angle formula for sine,The formula sin 2A = 2 tan A / (1 + tan² A) expressing sine of double an angle in terms of tangent.,Algebraic Concepts,Trigonometric identities,7_Leaving Cert Maths-Trig_Formulae.pdf
b45067eb-9152-437d-9368-83d17172aae0,Alternative double angle formula for cosine,The formula cos 2A = (1 – tan² A) / (1 + tan² A) expressing cosine of double an angle in terms of tangent.,Algebraic Concepts,Trigonometric identities,7_Leaving Cert Maths-Trig_Formulae.pdf
9d0a8f24-b52d-4062-9e7c-1c806f7a2434,Double angle formula for tangent,The formula tan 2A = 2 tan A / (1 – tan² A) expressing tangent of double an angle in terms of tangent.,Algebraic Concepts,Trigonometric identities,7_Leaving Cert Maths-Trig_Formulae.pdf
36534e7e-810e-4468-a0d1-ab63c6742634,Cosine squared in terms of cosine double angle,The formula cos² A = ½ (1 + cos 2A) expressing the square of cosine in terms of cosine of double angle.,Algebraic Concepts,Trigonometric identities,7_Leaving Cert Maths-Trig_Formulae.pdf
82b4ed3e-c6fb-4a74-b199-e8d6af6bc95e,Sine squared in terms of cosine double angle,The formula sin² A = ½ (1 – cos 2A) expressing the square of sine in terms of cosine of double angle.,Algebraic Concepts,Trigonometric identities,7_Leaving Cert Maths-Trig_Formulae.pdf
733cd25c-3c82-42e8-af21-bf6169a1ec0e,Product to sum formula: 2 cos A cos B,The formula 2 cos A cos B = cos(A+B) + cos(A–B) expressing product of cosines as sum of cosines.,Algebraic Concepts,Trigonometric identities,7_Leaving Cert Maths-Trig_Formulae.pdf
e0b24d2e-392f-4512-86ca-9787500e4e9b,Product to sum formula: 2 sin A cos B,The formula 2 sin A cos B = sin(A+B) + sin(A–B) expressing product of sine and cosine as sum of sines.,Algebraic Concepts,Trigonometric identities,7_Leaving Cert Maths-Trig_Formulae.pdf
95e578b7-cd6b-4aaf-b312-c1851894e8d5,Product to sum formula: 2 sin A sin B,The formula 2 sin A sin B = cos(A–B) – cos(A+B) expressing product of sines as difference of cosines.,Algebraic Concepts,Trigonometric identities,7_Leaving Cert Maths-Trig_Formulae.pdf
6580a5b8-23c6-4824-bfb0-8edfba667d0d,Product to sum formula: 2 cos A sin B,The formula 2 cos A sin B = sin(A+B) – sin(A–B) expressing product of cosine and sine as difference of sines.,Algebraic Concepts,Trigonometric identities,7_Leaving Cert Maths-Trig_Formulae.pdf
d5b50307-f23d-4214-bb48-5999060ad3c0,Sum to product formula: cos A + cos B,The formula cos A + cos B = 2 cos((A+B)/2) cos((A–B)/2) expressing sum of cosines as product of cosines.,Algebraic Concepts,Trigonometric identities,7_Leaving Cert Maths-Trig_Formulae.pdf
f4f5d2df-e994-4088-8a34-28428e23dd28,Sum to product formula: cos A – cos B,The formula cos A – cos B = –2 sin((A+B)/2) sin((A–B)/2) expressing difference of cosines as product of sines.,Algebraic Concepts,Trigonometric identities,7_Leaving Cert Maths-Trig_Formulae.pdf
f67f3d6b-bcbe-47f3-8077-c51dc050f71e,Sum to product formula: sin A + sin B,The formula sin A + sin B = 2 sin((A+B)/2) cos((A–B)/2) expressing sum of sines as product of sine and cosine.,Algebraic Concepts,Trigonometric identities,7_Leaving Cert Maths-Trig_Formulae.pdf
8fa64ea3-223f-4127-a11d-4dababd452b4,Sum to product formula: sin A – sin B,The formula sin A – sin B = 2 cos((A+B)/2) sin((A–B)/2) expressing difference of sines as product of cosine and sine.,Algebraic Concepts,Trigonometric identities,7_Leaving Cert Maths-Trig_Formulae.pdf
a446562b-92c2-4939-9c23-b67c95300dcf,Pythagorean Identity,"The fundamental trigonometric identity stating that the square of cosine of an angle plus the square of sine of the same angle equals one, i.e., cos²A + sin²A = 1.",Geometric Concepts,Trigonometry,7_Leaving Cert Maths-Trig_Formulae.pdf
9df521f4-8272-4159-aad9-03aad8d2c822,Sine Rule,"A formula relating the lengths of sides of a triangle to the sines of its opposite angles, expressed as a/sin A = b/sin B = c/sin C.",Geometric Concepts,Trigonometry,7_Leaving Cert Maths-Trig_Formulae.pdf
c1fcfbad-3e26-4e96-b671-2ce40c98b065,Cosine Rule,"A formula that relates the lengths of the sides of a triangle to the cosine of one of its angles, given by a² = b² + c² – 2bc cos A.",Geometric Concepts,Trigonometry,7_Leaving Cert Maths-Trig_Formulae.pdf
5a97b90d-23a5-4239-9d0a-e44dfa398c9e,Half-Angle Formula for Cosine Squared,The identity expressing cos²A as ½ (1 + cos 2A).,Geometric Concepts,Trigonometric Identities,7_Leaving Cert Maths-Trig_Formulae.pdf
6e9a6ef0-cccb-4faf-837c-25c336a87c0c,Half-Angle Formula for Sine Squared,The identity expressing sin²A as ½ (1 – cos 2A).,Geometric Concepts,Trigonometric Identities,7_Leaving Cert Maths-Trig_Formulae.pdf
a69fd654-da2d-4029-8785-f1f9914fca82,Product-to-Sum Formula: 2 cos A cos B,The identity expressing 2 cos A cos B as cos(A+B) + cos(A–B).,Geometric Concepts,Trigonometric Identities,7_Leaving Cert Maths-Trig_Formulae.pdf
faf3e911-b3b5-4667-878d-e5e60acc52bc,Product-to-Sum Formula: 2 sin A cos B,The identity expressing 2 sin A cos B as sin(A+B) + sin(A–B).,Geometric Concepts,Trigonometric Identities,7_Leaving Cert Maths-Trig_Formulae.pdf
84e01e9f-4c53-44c6-a1d4-aafd643da152,Product-to-Sum Formula: 2 sin A sin B,The identity expressing 2 sin A sin B as cos(A–B) – cos(A+B).,Geometric Concepts,Trigonometric Identities,7_Leaving Cert Maths-Trig_Formulae.pdf
750c6221-b896-4831-9d02-af80d62089ae,Product-to-Sum Formula: 2 cos A sin B,The identity expressing 2 cos A sin B as sin(A+B) – sin(A–B).,Geometric Concepts,Trigonometric Identities,7_Leaving Cert Maths-Trig_Formulae.pdf
dabe3a9e-8ef7-4441-a2f3-60a1f930ded9,Sum-to-Product Formula: cos A + cos B,The identity expressing cos A + cos B as 2 cos((A+B)/2) cos((A–B)/2).,Geometric Concepts,Trigonometric Identities,7_Leaving Cert Maths-Trig_Formulae.pdf
e9031571-6fb9-466c-bc41-746336ac812e,Sum-to-Product Formula: cos A – cos B,The identity expressing cos A – cos B as –2 sin((A+B)/2) sin((A–B)/2).,Geometric Concepts,Trigonometric Identities,7_Leaving Cert Maths-Trig_Formulae.pdf
87900dc0-88f9-429c-a9ef-e37611fc7c58,Sum-to-Product Formula: sin A + sin B,The identity expressing sin A + sin B as 2 sin((A+B)/2) cos((A–B)/2).,Geometric Concepts,Trigonometric Identities,7_Leaving Cert Maths-Trig_Formulae.pdf
86003a21-3cb0-4996-9297-a5d4d5c86a41,Sum-to-Product Formula: sin A – sin B,The identity expressing sin A – sin B as 2 cos((A+B)/2) sin((A–B)/2).,Geometric Concepts,Trigonometric Identities,7_Leaving Cert Maths-Trig_Formulae.pdf
f3aaf0fb-982c-4239-81c2-54c76812e923,Tangent double angle formula,The formula expressing tan 2A in terms of tan A: tan 2A = 2 tan A / (1 – tan² A).,Double angle formulas,Trigonometry,7_Leaving Cert Maths-Trig_Formulae.pdf
24b67b87-9f2a-432d-a3ce-6ea0cb114d27,Half-angle formulas,"Formulas expressing squares of sine and cosine in terms of cosine of double angles, e.g., cos² A = ½ (1 + cos 2A), sin² A = ½ (1 – cos 2A).",Trigonometric identities,Trigonometry,7_Leaving Cert Maths-Trig_Formulae.pdf
a7bc2e16-fc83-4e98-8ff7-99d1ab9f00b3,drawing a circle of given radius,Constructing a circle using a compass with a specified radius from a given center point.,Geometric Concepts,Synthetic geometry,4_Curriculum csvs - Geometry&Trig.csv
e36b39c7-fac5-4b9c-997d-7e5c1347252c,using straight edge for geometric constructions,Employing a straight edge tool to draw straight lines accurately in geometric diagrams.,Geometric Concepts,Synthetic geometry,4_Curriculum csvs - Geometry&Trig.csv
44e3d3ab-2ae0-4889-b7e5-c82cf42bf6b2,using compass for geometric constructions,Using a compass to draw arcs and circles and to transfer distances in geometric constructions.,Geometric Concepts,Synthetic geometry,4_Curriculum csvs - Geometry&Trig.csv
aa3e0438-8d61-44dc-9c14-9f691b8572d2,using ruler for geometric constructions,Utilizing a ruler to measure lengths and draw straight lines in geometric diagrams.,Geometric Concepts,Synthetic geometry,4_Curriculum csvs - Geometry&Trig.csv
10a23d47-5af7-4d3a-9da5-3ea5affd8efe,using protractor for angle measurement,Employing a protractor to measure and construct angles accurately in geometric figures.,Geometric Concepts,Synthetic geometry,4_Curriculum csvs - Geometry&Trig.csv
ed09b96d-bfb8-4db8-9d32-1f995447fbe5,using set square for perpendicular and parallel lines,Using a set square tool to draw perpendicular and parallel lines in geometric constructions.,Geometric Concepts,Synthetic geometry,4_Curriculum csvs - Geometry&Trig.csv
03cf1742-148e-4768-93e5-8a64e87048f2,co-ordinating the plane,"Assigning ordered pairs (x, y) to points in the plane to represent geometric figures algebraically.",Geometric Concepts,Co-ordinate geometry,4_Curriculum csvs - Geometry&Trig.csv
2536c003-bd52-4725-9c55-78a37210e79b,representing linear relationships graphically,Plotting linear equations on the Cartesian plane to visualize relationships between variables.,Geometric Concepts,Co-ordinate geometry,4_Curriculum csvs - Geometry&Trig.csv
d2981042-6bc9-452a-b6f1-d2179c50107b,calculating slope of a line,Determining the rate of change or steepness of a line given two points or an equation.,Geometric Concepts,Co-ordinate geometry,4_Curriculum csvs - Geometry&Trig.csv
22b15914-0191-43ee-ab23-62b7ffc9eed4,finding point of intersection of two lines,Calculating the coordinates where two linear equations meet on the Cartesian plane.,Geometric Concepts,Co-ordinate geometry,4_Curriculum csvs - Geometry&Trig.csv
903d4878-32e5-43b4-a5f7-1e3d849c3ee5,showing lines are parallel using slopes,Using the equality of slopes to prove that two lines are parallel.,Geometric Concepts,Co-ordinate geometry,4_Curriculum csvs - Geometry&Trig.csv
0d0d9828-aca2-4dae-b08c-c8264cb37593,showing lines are perpendicular using slopes,Using the negative reciprocal relationship of slopes to prove that two lines are perpendicular.,Geometric Concepts,Co-ordinate geometry,4_Curriculum csvs - Geometry&Trig.csv
60615890-2b52-4005-a941-fc9b189f7227,calculating area of a triangle using coordinates,Using coordinate geometry formulas to find the area of a triangle given its vertices.,Geometric Concepts,Co-ordinate geometry,4_Curriculum csvs - Geometry&Trig.csv
6b4a8e27-0f42-44c6-a228-8bf30fcf1e66,"equation of a circle with center (h,k) and radius r",Using the formula (x - h)² + (y - k)² = r² to represent all points on a circle in the coordinate plane.,Geometric Concepts,Co-ordinate geometry,4_Curriculum csvs - Geometry&Trig.csv
36666659-d769-4173-8310-cb4e92e99d70,equation of a circle in general form,Representing a circle by the equation x² + y² + 2gx + 2fy + c = 0 and relating it to center and radius.,Geometric Concepts,Co-ordinate geometry,4_Curriculum csvs - Geometry&Trig.csv
9d62ddce-1565-463b-85d5-edebb6018184,perpendicular distance from a point to a line,Calculating the shortest distance between a given point and a specified line in the plane.,Geometric Concepts,Co-ordinate geometry,4_Curriculum csvs - Geometry&Trig.csv
94d87d92-1f09-49e0-96f2-212d69386bc9,angle between two lines,Determining the measure of the angle formed where two lines intersect using their slopes.,Geometric Concepts,Co-ordinate geometry,4_Curriculum csvs - Geometry&Trig.csv
ad4b052d-caeb-4668-9291-0feb8d7ec9d5,dividing a line segment internally in a given ratio,Finding the coordinates of a point that divides a line segment between two points in a specified ratio m:n.,Geometric Concepts,Co-ordinate geometry,4_Curriculum csvs - Geometry&Trig.csv
573bf5a8-2f54-43dd-b739-ce61344f73fe,applying theorem of Pythagoras in 2D,Using the relation a² + b² = c² to solve problems involving right-angled triangles in two dimensions.,Geometric Concepts,Trigonometry,4_Curriculum csvs - Geometry&Trig.csv
f225f9c7-4643-4349-81d6-bb473fbbdf4f,using trigonometric ratios to solve right-angled triangles,"Applying sine, cosine, and tangent ratios to find unknown sides or angles in right-angled triangles.",Geometric Concepts,Trigonometry,4_Curriculum csvs - Geometry&Trig.csv
65dbeaec-5af3-40db-87c2-32b8cf24da95,using sine rule to solve triangles,Applying the sine rule a/sin A = b/sin B = c/sin C to find unknown sides or angles in any triangle.,Geometric Concepts,Trigonometry,4_Curriculum csvs - Geometry&Trig.csv
d0788d64-66e7-4e52-bf1b-56e602e71052,using cosine rule to solve triangles,Applying the cosine rule c² = a² + b² - 2ab cos C to find unknown sides or angles in any triangle.,Geometric Concepts,Trigonometry,4_Curriculum csvs - Geometry&Trig.csv
9eb1be31-5763-4227-a949-1deaa5f4a75f,defining sine and cosine for all angle values,"Extending the definitions of sine and cosine functions beyond acute angles to all real angles, including negative and reflex angles.",Geometric Concepts,Trigonometry,4_Curriculum csvs - Geometry&Trig.csv
d00dc713-4b50-4147-b120-f587a3be587a,defining tangent function,Defining tangent as the ratio of sine to cosine for all angles where cosine is not zero.,Geometric Concepts,Trigonometry,4_Curriculum csvs - Geometry&Trig.csv
c95c2dec-3a0c-4b7f-93d3-16d12c1349d7,calculating area of a sector of a circle,Finding the area of a sector using the formula (1/2) r² θ where θ is in radians.,Geometric Concepts,Trigonometry,4_Curriculum csvs - Geometry&Trig.csv
1472aa30-1e22-444f-b443-3a55044cceeb,calculating length of an arc,Determining the length of an arc of a circle using the formula r θ where θ is in radians.,Geometric Concepts,Trigonometry,4_Curriculum csvs - Geometry&Trig.csv
89238162-8974-41d7-9fed-63ccfc211eaf,working with trigonometric ratios in surd form,Expressing trigonometric ratios exactly using square roots and irrational numbers instead of decimal approximations.,Geometric Concepts,Trigonometry,4_Curriculum csvs - Geometry&Trig.csv
7ebd1035-c287-49be-8b90-a7ca24541d3c,solving trigonometric equations,"Finding all solutions to equations involving sine, cosine, or tangent functions, such as sin nθ = 0 or cos nθ = 1/2.",Geometric Concepts,Trigonometry,4_Curriculum csvs - Geometry&Trig.csv
43532f12-4cdb-4c99-841a-cee95158192c,using radian measure of angles,"Measuring angles in radians, where one radian is the angle subtended by an arc equal in length to the radius.",Geometric Concepts,Trigonometry,4_Curriculum csvs - Geometry&Trig.csv
c25f9d27-ad7c-48ec-9a29-2de28d770ee5,"graphing sine, cosine, and tangent functions","Plotting the periodic graphs of sine, cosine, and tangent functions over intervals of angles.",Geometric Concepts,Trigonometry,4_Curriculum csvs - Geometry&Trig.csv
4027dee3-4a4d-4ac2-b102-e8e39a27cc2d,performing translations,Moving every point of a shape the same distance in the same direction without rotation or reflection.,Geometric Concepts,Transformation geometry,4_Curriculum csvs - Geometry&Trig.csv
ebad7f5b-4528-4da5-94cf-d698df1e390d,performing central symmetry,Reflecting a shape about a central point so that each point and its image are on a line through the center and equidistant from it.,Geometric Concepts,Transformation geometry,4_Curriculum csvs - Geometry&Trig.csv
219b69a8-0eb8-4464-841f-1f4cbe057bc0,performing axial symmetry,Reflecting a shape across a line (axis of symmetry) so that the shape and its image are mirror images.,Geometric Concepts,Transformation geometry,4_Curriculum csvs - Geometry&Trig.csv
a7ae795b-a4e2-4e94-925b-c55a4c346a02,performing rotations,Turning a shape about a fixed point through a specified angle and direction.,Geometric Concepts,Transformation geometry,4_Curriculum csvs - Geometry&Trig.csv
81f72d27-7878-408d-99c8-e66cf7010b18,investigating enlargements,Studying the transformation that produces an image similar to the original shape but scaled by a factor k from a center of enlargement.,Geometric Concepts,Transformation geometry,4_Curriculum csvs - Geometry&Trig.csv
082662ed-bdf4-46ce-bad4-e5aa93d0ab5d,understanding scale factor in enlargements,"The ratio k by which lengths are multiplied during an enlargement, where k > 0 and can be less than, equal to, or greater than 1.",Geometric Concepts,Transformation geometry,4_Curriculum csvs - Geometry&Trig.csv
6a1fb8a9-1d73-4da2-836c-6eb5fd8a396c,locating axes of symmetry in shapes,Identifying lines about which a shape can be reflected onto itself.,Geometric Concepts,Transformation geometry,4_Curriculum csvs - Geometry&Trig.csv
758d5d93-27d2-4e77-8e20-4c78ba05c68b,representing linear relationships in tabular form,Organizing values of variables in tables to show linear relationships numerically.,Algebraic Concepts,Co-ordinate geometry,4_Curriculum csvs - Geometry&Trig.csv
5e170685-6881-440d-9d15-9d3bb6fc6bef,interpreting slope as rate of change,Understanding the slope of a graph as the rate at which one variable changes relative to another.,Algebraic Concepts,Co-ordinate geometry,4_Curriculum csvs - Geometry&Trig.csv
242bf1ff-6cc4-4bd6-a3e9-a9c845c08fc3,finding point of intersection of two linear relationships,Determining the coordinate point where two linear graphs meet or cross.,Algebraic Concepts,Co-ordinate geometry,4_Curriculum csvs - Geometry&Trig.csv
18cbada3-1cba-41a0-b0c5-f377cb11eb58,using slope to determine parallel lines,Showing that two lines are parallel if they have equal slopes.,Algebraic Concepts,Co-ordinate geometry,4_Curriculum csvs - Geometry&Trig.csv
a0002ce9-515b-4168-83fa-0283c1fb5b7e,using slope to determine perpendicular lines,Showing that two lines are perpendicular if the product of their slopes is -1.,Algebraic Concepts,Co-ordinate geometry,4_Curriculum csvs - Geometry&Trig.csv
75d1d1ab-564e-418f-aee0-ae774ef75c03,recognizing linear equation in standard form,Identifying equations of the form ax + by + c = 0 as linear equations representing lines.,Algebraic Concepts,Co-ordinate geometry,4_Curriculum csvs - Geometry&Trig.csv
629cd342-8f8c-4f78-91a8-ce8c9806505d,finding perpendicular distance from a point to a line,Calculating the shortest distance between a given point and a specified line in the plane.,Algebraic Concepts,Co-ordinate geometry,4_Curriculum csvs - Geometry&Trig.csv
dc3713d5-86f4-425d-b5df-cc7223f5d485,finding angle between two lines,Determining the measure of the angle formed where two lines intersect using their slopes.,Algebraic Concepts,Co-ordinate geometry,4_Curriculum csvs - Geometry&Trig.csv
984782ab-a8d1-4e25-89d5-eba636423bb1,applying Pythagoras' theorem to solve right-angled triangle problems,Using the relationship a² + b² = c² to find missing sides in right-angled triangles.,Algebraic Concepts,Trigonometry,4_Curriculum csvs - Geometry&Trig.csv
046d1bc1-915a-405b-beff-d8c5968d2f38,using trigonometric ratios to solve angle problems,"Applying sine, cosine, and tangent ratios to find unknown angles or sides in right-angled triangles.",Algebraic Concepts,Trigonometry,4_Curriculum csvs - Geometry&Trig.csv
ababf4e1-ae03-4e7f-975d-96cee2178094,calculating area of a triangle using trigonometry,Using formulas involving sine of an angle to find the area of a triangle.,Algebraic Concepts,Trigonometry,4_Curriculum csvs - Geometry&Trig.csv
6b0919a4-bd63-4d09-a81e-b55b5da1eb8a,solving problems using sine rule,Applying the sine rule a/sin A = b/sin B = c/sin C to find unknown sides or angles in any triangle.,Algebraic Concepts,Trigonometry,4_Curriculum csvs - Geometry&Trig.csv
5420a5af-3f35-4684-9b04-f971623410b3,solving problems using cosine rule,Using the cosine rule a² = b² + c² – 2bc cos A to find unknown sides or angles in any triangle.,Algebraic Concepts,Trigonometry,4_Curriculum csvs - Geometry&Trig.csv
8ed95a0f-6ae6-4dfc-b9bc-e7ff67bd9c2e,graphing functions of the form f(θ) = a + b sin cθ,"Plotting sinusoidal functions with amplitude, vertical shift, and frequency parameters a, b, and c.",Algebraic Concepts,Trigonometry,4_Curriculum csvs - Geometry&Trig.csv
97122ae3-bb85-48b3-8a66-1ac3b955be4d,graphing functions of the form g(θ) = a + b cos cθ,"Plotting cosine-based sinusoidal functions with parameters controlling amplitude, vertical shift, and frequency.",Algebraic Concepts,Trigonometry,4_Curriculum csvs - Geometry&Trig.csv
6b40df2b-7b04-4b76-933c-4f555f8cb593,solving trigonometric equations such as sin nθ = 0,Finding all angle solutions θ that satisfy equations where sine of a multiple of θ equals zero.,Algebraic Concepts,Trigonometry,4_Curriculum csvs - Geometry&Trig.csv
070ed7fd-3acf-4977-bb37-b5ca19e0944d,solving trigonometric equations such as cos nθ = 1/2,Determining all angle solutions θ where cosine of a multiple of θ equals one half.,Algebraic Concepts,Trigonometry,4_Curriculum csvs - Geometry&Trig.csv
b00ef6b5-0459-4fb9-8ac6-4620cae9a15e,investigating enlargements with scale factor k,"Studying transformations that enlarge or reduce shapes by a scale factor k, where k is a positive rational number.",Algebraic Concepts,Transformation geometry,4_Curriculum csvs - Geometry&Trig.csv
fd75bccc-34dc-4145-b667-c845ee4bfc9b,locating centre of enlargement,Identifying the fixed point from which all points of a shape are enlarged or reduced during a transformation.,Algebraic Concepts,Transformation geometry,4_Curriculum csvs - Geometry&Trig.csv
1d8e8926-2978-47f6-8c6c-b7e505a5f7be,recognizing images under translation,Understanding how points and shapes move uniformly in a given direction without rotation or resizing.,Algebraic Concepts,Transformation geometry,4_Curriculum csvs - Geometry&Trig.csv
b3ce443d-4899-4145-baa1-1f2062f6632c,Pythagorean theorem application in right-angled triangles,"Using the Pythagorean theorem (a² + b² = c²) to solve problems involving the lengths of sides in right-angled triangles, including real-world height and distance problems.",Trigonometry,Right-angled triangles and trigonometric ratios,4_Curriculum csvs - Geometry&Trig.csv
04e67fdf-1e03-4923-8c59-54e1d9d90aaa,Trigonometric ratios in right-angled triangles,"The ratios sine, cosine, and tangent defined as opposite/hypotenuse, adjacent/hypotenuse, and opposite/adjacent respectively, used to relate angles to side lengths in right-angled triangles.",Trigonometry,Right-angled triangles and trigonometric ratios,4_Curriculum csvs - Geometry&Trig.csv
4fea9e07-fac6-40ca-b045-c595a9dfd6a0,Using trigonometric ratios to solve real-world angle problems,"Applying sine, cosine, and tangent ratios to calculate unknown sides or angles in practical contexts involving right-angled triangles.",Trigonometry,Right-angled triangles and trigonometric ratios,4_Curriculum csvs - Geometry&Trig.csv
891bfb8a-b262-4efa-83f0-d9fea39e7f72,Calculating the area of a triangle using trigonometry,Using the formula (1/2)ab sin C to find the area of any triangle by applying trigonometric functions to two sides and the included angle.,Trigonometry,Area calculation using trigonometry,4_Curriculum csvs - Geometry&Trig.csv
9fac6d74-345c-4832-837f-e9f402dde893,Sine rule for solving triangles,Using the sine rule a/sin A = b/sin B = c/sin C to find unknown sides or angles in any triangle.,Trigonometry,Non-right angled triangle solutions,4_Curriculum csvs - Geometry&Trig.csv
