id,name,explanation,broader_concept,strand,source
211e2892-dbe9-45f4-8510-222f79364f03,interpreting rate of change and y-intercept in context,Understanding how the slope (rate of change) and y-intercept relate to real-world situations and appear in different representations.,linear relationship analysis,Algebra,3_Curriculum csvs - Algebra.csv
f3cf522c-672f-4ab7-b77e-11ac2ef66125,determining common values of two linear relationships,Finding values where two linear relationships intersect or share the same output.,linear relationship analysis,Algebra,3_Curriculum csvs - Algebra.csv
2e47793c-b099-40d8-a089-3259eb3f13bb,recognising and solving direct proportion problems,Identifying situations where two quantities vary directly and using proportional reasoning to solve problems.,proportional reasoning,Number,3_Curriculum csvs - Algebra.csv
03ae6f08-0f9f-46f2-82aa-76993f2fbce6,exploring motion graphs quantitatively,"Using graphs to represent and analyze motion, interpreting changes in quantity over time.",graph interpretation,Measurement and Geometry,3_Curriculum csvs - Algebra.csv
0c862804-f15c-4884-b5d3-e577c674f89d,connecting graph shape to real-world phenomena,Relating the shape and features of a graph to the story or behavior of the phenomenon it represents.,graph interpretation,Measurement and Geometry,3_Curriculum csvs - Algebra.csv
fa212129-f6c0-4b03-bf61-bf9cdd604554,evaluating algebraic expressions given variable values,Calculating the numerical value of expressions by substituting specific values for variables.,expression evaluation,Algebra,3_Curriculum csvs - Algebra.csv
9ce61eef-fde5-481d-bc89-bcf552ccc1ea,expanding algebraic expressions,Using distributive property to multiply out brackets and rewrite expressions as sums of terms.,expression manipulation,Algebra,3_Curriculum csvs - Algebra.csv
51d70bbb-0115-4978-9469-e5e5996c09fc,re-grouping algebraic expressions,Rearranging terms in expressions to group like terms together for simplification.,expression manipulation,Algebra,3_Curriculum csvs - Algebra.csv
a6d64930-517d-43ca-a819-d3b77b256380,factorising quadratic expressions,Expressing quadratic expressions as products of binomials or other factors.,expression manipulation,Algebra,3_Curriculum csvs - Algebra.csv
de407c06-1897-4080-9c5c-ff0c5b9faded,adding and subtracting linear algebraic expressions,"Performing addition and subtraction on expressions of the form ax + by + c, combining like terms.",expression manipulation,Algebra,3_Curriculum csvs - Algebra.csv
42c385f5-e1e1-47a4-8669-268d3548220e,adding and subtracting quadratic algebraic expressions,"Performing addition and subtraction on expressions of the form ax² + bx + c, combining like terms.",expression manipulation,Algebra,3_Curriculum csvs - Algebra.csv
7870b058-fc76-4a67-8eab-9e2e43b75b23,simplifying expressions using associative and distributive properties,Applying associative and distributive laws to simplify complex algebraic expressions with multiple terms and brackets.,expression simplification,Algebra,3_Curriculum csvs - Algebra.csv
cdac99a7-98e6-4b7a-bf9f-42184114a9e6,multiplying binomials,Using distributive property to multiply expressions of the form (x ± y)(w ± z) and expand the product.,expression manipulation,Algebra,3_Curriculum csvs - Algebra.csv
7c9544ac-15b5-4755-8910-73a333813c3c,rearranging formulae,Manipulating algebraic formulae to isolate a specific variable or rewrite the formula in an equivalent form.,formula manipulation,Algebra,3_Curriculum csvs - Algebra.csv
0faadb24-1c50-4a52-b1cc-d66379f57be8,arithmetic operations on polynomials and rational algebraic expressions,"Performing addition, subtraction, multiplication, and division on polynomial and rational expressions, including careful use of brackets and surds.",expression operations,Algebra,3_Curriculum csvs - Algebra.csv
d1e21eb6-5655-4e18-b8f9-80b9831dc57d,applying the binomial theorem,Using the binomial theorem to expand powers of binomials into sums involving binomial coefficients.,polynomial expansion,Algebra,3_Curriculum csvs - Algebra.csv
aa13e95e-ef5e-4f99-b71c-762575e4c919,solving linear equations with rational coefficients,Finding solutions to equations of the form ax + b = cx + d where coefficients and constants are rational numbers.,equation solving,Algebra,3_Curriculum csvs - Algebra.csv
dc11ae97-158e-4eea-ad30-8799f370d9b1,"using graphic, numeric, and mental strategies to solve linear equations","Employing graphical plots, numerical tables, or mental calculations to find solutions to linear equations.",equation solving strategies,Algebra,3_Curriculum csvs - Algebra.csv
569eefd9-85ec-41d8-87b2-ea051997fd28,solving simultaneous linear equations with two unknowns,Finding values of two variables that satisfy two linear equations simultaneously.,simultaneous equations,Algebra,3_Curriculum csvs - Algebra.csv
48f91890-ed92-4eed-8a32-47878634d048,solving simultaneous equations with one linear and one quadratic equation,"Finding solutions to systems consisting of one linear equation and one quadratic equation with two unknowns, with restrictions on coefficients.",simultaneous equations,Algebra,3_Curriculum csvs - Algebra.csv
85b3be85-64a5-4c0c-a780-3438a2578165,forming quadratic equations from given roots,Constructing quadratic equations when the roots (solutions) are known whole numbers.,equation formation,Algebra,3_Curriculum csvs - Algebra.csv
69b2832c-d2bd-4e17-84e5-f219f9b69f4c,using the Factor Theorem for polynomials,Applying the Factor Theorem to determine if a binomial is a factor of a polynomial and to find polynomial roots.,polynomial factorisation,Algebra,3_Curriculum csvs - Algebra.csv
0a673a93-9624-4e56-9062-0d448cd378d8,solving cubic equations with at least one integer root,"Finding solutions to cubic polynomial equations when at least one root is an integer, using suitable strategies.",equation solving,Algebra,3_Curriculum csvs - Algebra.csv
197e8c28-1849-4777-9dcd-bd84e0fd216b,solving simultaneous linear equations with three unknowns,Finding values of three variables that satisfy three linear equations simultaneously.,simultaneous equations,Algebra,3_Curriculum csvs - Algebra.csv
2507b81b-7975-45c1-8a44-ece98059d3ba,solving linear inequalities with rational coefficients,Finding solution sets to inequalities of the form g(x) ≤ k or g(x) ≥ k where g(x) = ax + b and coefficients/constants are rational.,inequality solving,Algebra,3_Curriculum csvs - Algebra.csv
45300004-b5d9-4bdd-b240-819b83aec8c2,solving quadratic inequalities with rational coefficients,Finding solution sets to inequalities where g(x) = ax² + bx + c with rational coefficients and constants.,inequality solving,Algebra,3_Curriculum csvs - Algebra.csv
5a612696-c2e9-47e4-b361-eed3273eb5c1,solving absolute value inequalities,Finding solution sets to inequalities involving absolute values such as |x – a| < b or |x – a| > b with rational parameters.,inequality solving,Algebra,3_Curriculum csvs - Algebra.csv
420390aa-91a7-4ddc-a9a8-a7988c700c83,using absolute value notation,Understanding and applying the notation |x| to represent the distance of x from zero on the number line.,number properties,Number,3_Curriculum csvs - Algebra.csv
0f8810ba-5efd-43a5-9435-b6358e62013c,using the Conjugate Root Theorem for polynomial roots,Applying the theorem that non-real roots of polynomials with real coefficients occur in conjugate pairs to find roots.,polynomial roots,Algebra,3_Curriculum csvs - Algebra.csv
3aa6eb62-fca4-4a35-86df-ca1803a087a1,working with complex numbers in rectangular form,Representing complex numbers as a + bi and performing operations to solve equations.,complex number operations,Complex Numbers,3_Curriculum csvs - Algebra.csv
0195226a-3eaf-4a07-a706-3220cc17c7b0,working with complex numbers in polar form,Representing complex numbers using modulus and argument as r(Cos θ + i Sin θ) for solving equations.,complex number operations,Complex Numbers,3_Curriculum csvs - Algebra.csv
82c4cd8b-e887-4b1b-9135-fcee5f363a2c,using De Moivre’s Theorem,Applying De Moivre’s Theorem to raise complex numbers in polar form to integer powers.,complex number operations,Complex Numbers,3_Curriculum csvs - Algebra.csv
25fe3caa-1e9e-4709-85fa-294d37dec153,proving De Moivre’s Theorem by induction,Using mathematical induction to prove the validity of De Moivre’s Theorem for natural number powers.,proof techniques,Complex Numbers,3_Curriculum csvs - Algebra.csv
547daee2-4b46-4c30-adb0-1e5db9c2c230,finding nth roots of unity,"Determining the complex solutions to the equation zⁿ = 1, representing the nth roots of unity on the complex plane.",complex number operations,Complex Numbers,3_Curriculum csvs - Algebra.csv
8166c58a-5f12-49aa-acab-2905eb0c743c,using trigonometric identities involving cosine of triple angles,Applying identities such as Cos 3θ = 4 Cos³ θ – 3 Cos θ to simplify or solve problems involving trigonometric expressions.,trigonometric identities,Trigonometry,3_Curriculum csvs - Algebra.csv
bf344826-4c69-4ca9-b99e-bc8d5de8059c,line passing through a given point,"The concept that a line contains a specific point, meaning the point lies on the infinite set of points that form the line.",line,Geometry,6_Leaving Cert Maths-Geometry_Detail.pdf
f1b67e2d-daa1-4fc2-b478-db71f5310884,undeﬁned geometric terms,"Basic geometric terms such as angle, degree, length, line, plane, point, ray, real number, and set which are accepted without formal definition to build further concepts.",geometric foundations,Geometry,6_Leaving Cert Maths-Geometry_Detail.pdf
35400bb2-a0c9-4fb0-9d19-58cb8c76be60,defined geometric terms for shapes and angles,"Explicitly defined geometric terms including area, parallel lines, parallelogram, right angle, triangle, congruent triangles, similar triangles, tangent to a circle, acute angle, alternate angles, angle bisector, arc, base, apex, height, chord, circle, circumcentre, circumcircle, circumference, circumradius, collinear points, concurrent lines, convex quadrilateral, corresponding angles, diameter, disc, distance, equilateral triangle, exterior angles, full angle, hypotenuse, incentre, incircle, inradius, interior opposite angles, isosceles triangle, median lines, midpoint of a segment, null angle, obtuse angle, perpendicular bisector, perpendicular lines, point of contact of a tangent, polygon, quadrilateral, radius, ratio, rectangle, reflex angle, ordinary angle, rhombus, right-angled triangle, scalene triangle, sector, segment, square, straight angle, subset, supplementary angles, transversal line, vertically-opposite angles.",geometric terminology,Geometry,6_Leaving Cert Maths-Geometry_Detail.pdf
69778db0-9a33-4ce4-a059-0a05e090b234,line segment,The part of a line between two points including those endpoints.,line,Geometry,6_Leaving Cert Maths-Geometry_Detail.pdf
61a490cc-db97-4f64-9d29-29675c23ab44,ray (half-line),A part of a line that starts at a point and extends infinitely in one direction.,line,Geometry,6_Leaving Cert Maths-Geometry_Detail.pdf
ad7e367c-9269-4e00-a964-99558c36264b,collinear points,Three or more points that lie on the same straight line.,points and lines,Geometry,6_Leaving Cert Maths-Geometry_Detail.pdf
9a8c0e33-4daa-41cd-b905-8fae45f6afab,triangle defined by three non-collinear points,"A polygon formed by three line segments joining three non-collinear points, with sides and vertices.",polygons,Geometry,6_Leaving Cert Maths-Geometry_Detail.pdf
48240e72-6e44-4641-be14-a62b69efb323,distance between two points,"The non-negative length of the line segment connecting two points, denoted |AB|.",measurement,Geometry,6_Leaving Cert Maths-Geometry_Detail.pdf
4b017170-d894-4d99-b6fd-adc9d1d2a674,length of a line segment,The measure of the distance between the two endpoints of a segment.,measurement,Geometry,6_Leaving Cert Maths-Geometry_Detail.pdf
8035d32b-6e9f-49cd-8eec-72e5a8091c92,ruler axiom for distance,"Properties of distance including non-negativity, symmetry, additivity when a point lies between two others, and existence of a unique point at a given distance along a ray.",distance properties,Geometry,6_Leaving Cert Maths-Geometry_Detail.pdf
46390808-4f18-4ac5-b7c2-1c6d5cb51d32,midpoint of a segment,The point on a segment that divides it into two equal parts.,segment properties,Geometry,6_Leaving Cert Maths-Geometry_Detail.pdf
8830eae6-cd34-4d2c-974e-dbd4d275c589,convex set,A subset of the plane containing every segment connecting any two of its points.,set properties,Geometry,6_Leaving Cert Maths-Geometry_Detail.pdf
fcdc9c71-9262-4ea1-a7a6-d3c1e87dd4dc,angle and its components,"An angle consists of a vertex point and two rays (arms) starting at the vertex, enclosing a region called the inside of the angle.",angle basics,Geometry,6_Leaving Cert Maths-Geometry_Detail.pdf
9d200d55-a051-474c-935c-e2149317f5f4,null angle,"An angle whose arms coincide and whose inside is empty, measuring 0 degrees.",angle types,Geometry,6_Leaving Cert Maths-Geometry_Detail.pdf
6af948a1-6628-4c03-bd44-b62ef28fef1c,ordinary angle,"An angle with arms not on the same line and whose inside is a convex set, measuring between 0 and 180 degrees.",angle types,Geometry,6_Leaving Cert Maths-Geometry_Detail.pdf
f03aa0e2-be45-4845-b422-ef5b6ca5cf0c,straight angle,"An angle whose arms are opposite rays forming a straight line, measuring exactly 180 degrees.",angle types,Geometry,6_Leaving Cert Maths-Geometry_Detail.pdf
1a4aead5-8ee6-4d30-b0b9-04ebf2e441d0,reflex angle,"An angle with arms not on the same line and whose inside is not convex, measuring more than 180 degrees but less than 360 degrees.",angle types,Geometry,6_Leaving Cert Maths-Geometry_Detail.pdf
1425a922-cd9c-44db-9138-e64fcf70fa59,full angle,"An angle whose arms coincide and whose inside is the entire plane except the arms, measuring 360 degrees.",angle types,Geometry,6_Leaving Cert Maths-Geometry_Detail.pdf
28eba811-c493-4e47-9782-f662f87e1756,notation for angles using points and Greek letters,"Angles are denoted by three points with the vertex in the middle (e.g. \BAC), or by lowercase Greek letters when unnamed.",angle notation,Geometry,6_Leaving Cert Maths-Geometry_Detail.pdf
7fcb2b69-a0bd-4779-ace7-14d43db7969f,degree measure of an angle,"The numerical measure of an angle in degrees, ranging from 0° to 360°, with ordinary angles less than 180°.",angle measurement,Geometry,6_Leaving Cert Maths-Geometry_Detail.pdf
9decad8b-6cff-4b90-ac9c-29c8acadbf4f,protractor axiom,Axiomatic properties of angle measures including existence of unique rays forming given angles and additivity of angles inside another angle.,angle measurement properties,Geometry,6_Leaving Cert Maths-Geometry_Detail.pdf
7ac45f73-b707-4330-a178-a191775d07e0,angle bisector,A ray from the vertex of an angle dividing it into two equal angles.,angle division,Geometry,6_Leaving Cert Maths-Geometry_Detail.pdf
a350ae86-a172-4291-a932-a92630cceb2f,right angle,An angle measuring exactly 90 degrees.,angle types,Geometry,6_Leaving Cert Maths-Geometry_Detail.pdf
0b39a090-04f9-479a-bb21-45f4536a6086,acute angle,An angle measuring less than 90 degrees.,angle types,Geometry,6_Leaving Cert Maths-Geometry_Detail.pdf
9a8d594e-da5a-4353-8316-fb2ef47da57f,obtuse angle,An angle measuring more than 90 degrees but less than 180 degrees.,angle types,Geometry,6_Leaving Cert Maths-Geometry_Detail.pdf
774693c0-b1c8-41af-ba99-4fa92a7a2334,supplementary angles,Two angles whose measures add up to 180 degrees.,angle relationships,Geometry,6_Leaving Cert Maths-Geometry_Detail.pdf
c9c8673c-abfe-4a64-bf5b-5d973db87088,perpendicular lines,Two lines intersecting to form a right angle (90 degrees).,line relationships,Geometry,6_Leaving Cert Maths-Geometry_Detail.pdf
ec1e60b4-2c8e-4390-b850-15044386fb11,vertically-opposite angles,"Pairs of opposite angles formed when two lines intersect, which are equal in measure.",angle relationships,Geometry,6_Leaving Cert Maths-Geometry_Detail.pdf
544a23d2-4577-4448-9ed4-23d6dc6a9bef,congruent triangles,Two triangles with all corresponding sides and angles equal.,triangle properties,Geometry,6_Leaving Cert Maths-Geometry_Detail.pdf
d59f7da4-8160-42ff-80c2-9f99f14fcaee,"triangle congruence criteria (SAS, ASA, SSS)","Conditions under which two triangles are congruent: Side-Angle-Side, Angle-Side-Angle, or Side-Side-Side equalities.",triangle congruence,Geometry,6_Leaving Cert Maths-Geometry_Detail.pdf
22522d69-9a33-4159-81dd-564fab53dee9,right-angled triangle,A triangle with one angle exactly 90 degrees; the side opposite this angle is the hypotenuse.,triangle types,Geometry,6_Leaving Cert Maths-Geometry_Detail.pdf
6efda51b-90de-402a-a724-f291cf0e26b3,isosceles triangle,A triangle with two equal sides and consequently two equal opposite angles.,triangle types,Geometry,6_Leaving Cert Maths-Geometry_Detail.pdf
a74b9cb4-0ea5-493e-931f-18127a547355,equilateral triangle,A triangle with all three sides equal and all angles equal to 60 degrees.,triangle types,Geometry,6_Leaving Cert Maths-Geometry_Detail.pdf
5f8a1629-931b-4f04-97f8-a2d8ee665979,scalene triangle,A triangle with all sides of different lengths and all angles different.,triangle types,Geometry,6_Leaving Cert Maths-Geometry_Detail.pdf
ecc54b82-56ae-4c94-9451-3941781bd31a,parallel lines,"Two lines that are either identical or have no points in common, never intersecting.",line relationships,Geometry,6_Leaving Cert Maths-Geometry_Detail.pdf
104b7fc3-7937-45a4-8e7d-17bcca738868,transversal line,A line that intersects two or more other lines at distinct points.,line relationships,Geometry,6_Leaving Cert Maths-Geometry_Detail.pdf
33e425db-1ca9-4fa1-a1c0-8cdb43a94598,alternate interior angles,"Pairs of angles on opposite sides of a transversal but inside the two lines, which are equal if the lines are parallel.",angle relationships,Geometry,6_Leaving Cert Maths-Geometry_Detail.pdf
46e261b1-d764-4236-b838-e259ed5022b2,corresponding angles,"Pairs of angles in matching corners when a transversal crosses two lines, equal if the lines are parallel.",angle relationships,Geometry,6_Leaving Cert Maths-Geometry_Detail.pdf
bd94efef-6bda-4d60-8004-9eebc42b1c52,angle sum of triangle,The sum of the three interior angles of any triangle is exactly 180 degrees.,triangle properties,Geometry,6_Leaving Cert Maths-Geometry_Detail.pdf
f231eb35-8c6e-4472-a924-4356197da353,exterior angle of a triangle,An angle formed outside a triangle when one side is extended; equal to the sum of the two interior opposite angles.,triangle angle properties,Geometry,6_Leaving Cert Maths-Geometry_Detail.pdf
1a411efc-5320-41b8-9718-4983c6874935,angle-side inequality in triangles,"The angle opposite the longer side of a triangle is larger, and conversely, larger angles face longer sides.",triangle inequalities,Geometry,6_Leaving Cert Maths-Geometry_Detail.pdf
0216745a-7c1e-4690-9047-9a206cc3b289,triangle inequality theorem,The sum of the lengths of any two sides of a triangle is greater than the length of the third side.,triangle inequalities,Geometry,6_Leaving Cert Maths-Geometry_Detail.pdf
8a9958a8-adf8-486f-a8ae-d2792d3bc3e1,perpendicular bisector of a segment,"A line perpendicular to a segment at its midpoint, dividing it into two equal parts.",segment properties,Geometry,6_Leaving Cert Maths-Geometry_Detail.pdf
0c1e3b73-6b30-444b-a27c-0257f126f898,polygon,"A closed chain of line segments joined end-to-end without crossing, forming a plane figure with vertices and sides.",plane figures,Geometry,6_Leaving Cert Maths-Geometry_Detail.pdf
1b6d442a-51f8-41da-86b7-31b5be75e36a,quadrilateral,A polygon with exactly four vertices and four sides.,polygons,Geometry,6_Leaving Cert Maths-Geometry_Detail.pdf
e54f1353-de9d-4ecd-8ce5-e5f95ae14724,opposite sides and opposite angles of a quadrilateral,Pairs of sides or angles in a quadrilateral that do not share a vertex or side.,quadrilateral properties,Geometry,6_Leaving Cert Maths-Geometry_Detail.pdf
4523693c-18d7-48ec-b3c2-ae5392ab737e,rectangle,A quadrilateral with four right angles.,quadrilateral types,Geometry,6_Leaving Cert Maths-Geometry_Detail.pdf
b9c7b069-2ef5-4763-8fec-1ca987796785,rhombus,A quadrilateral with all four sides equal in length.,quadrilateral types,Geometry,6_Leaving Cert Maths-Geometry_Detail.pdf
6b50f898-fdc9-43b0-9f40-436aea91e376,square,"A quadrilateral that is both a rectangle and a rhombus, having four equal sides and four right angles.",quadrilateral types,Geometry,6_Leaving Cert Maths-Geometry_Detail.pdf
b0b6429f-c456-4089-ba62-cb3346153152,regular polygon,A polygon with all sides and all interior angles equal.,polygons,Geometry,6_Leaving Cert Maths-Geometry_Detail.pdf
0356fcbc-5e22-495e-a33a-ac435f715992,parallelogram,A quadrilateral with both pairs of opposite sides parallel.,quadrilateral types,Geometry,6_Leaving Cert Maths-Geometry_Detail.pdf
4724ddb8-93cc-4b95-9629-2f8dc1e35adb,diagonal divides parallelogram into congruent triangles,A diagonal of a parallelogram splits it into two triangles that are congruent.,parallelogram properties,Geometry,6_Leaving Cert Maths-Geometry_Detail.pdf
4747fd39-1d59-4365-a2b6-fcacc1458c17,ratio division of a segment,A point divides a segment into two parts whose lengths are in a given ratio s:t.,segment properties,Geometry,6_Leaving Cert Maths-Geometry_Detail.pdf
b481d066-2e81-4250-b8d6-410a28bdb373,similar triangles,Triangles with corresponding angles equal and corresponding sides proportional.,triangle similarity,Geometry,6_Leaving Cert Maths-Geometry_Detail.pdf
bf7c034e-391b-41e4-a9b6-944c53f3f8d7,properties of parallel lines cutting segments proportionally,"If three parallel lines cut equal segments on one transversal, they cut equal segments on any other transversal.",similarity and ratios,Geometry,6_Leaving Cert Maths-Geometry_Detail.pdf
8e1a7739-743c-4169-9f24-b4f11776c26c,"triangle similarity criteria (AA, SAS proportionality, SSS proportionality)","Conditions under which two triangles are similar: two equal angles, or two sides proportional with included angle equal, or all sides proportional.",triangle similarity,Geometry,6_Leaving Cert Maths-Geometry_Detail.pdf
7cc0536e-738c-4762-b5c9-ae81ed82cbef,Pythagorean theorem,"In a right-angled triangle, the square of the hypotenuse equals the sum of the squares of the other two sides.",triangle properties,Geometry,6_Leaving Cert Maths-Geometry_Detail.pdf
360d780f-3c27-42d1-bfd0-dc44a80d3a75,converse of Pythagorean theorem,"If the square of one side of a triangle equals the sum of the squares of the other two, then the triangle has a right angle opposite that side.",triangle properties,Geometry,6_Leaving Cert Maths-Geometry_Detail.pdf
c1973dbe-fbad-494f-a287-bc93d7272b86,RHS triangle congruence criterion,Two right-angled triangles are congruent if their hypotenuses and one other side are equal.,triangle congruence,Geometry,6_Leaving Cert Maths-Geometry_Detail.pdf
8481e3f8-b62e-48f8-bd1c-4cee56fa8d16,perpendicular bisector equidistance property,Any point on the perpendicular bisector of a segment is equidistant from the segment's endpoints.,segment properties,Geometry,6_Leaving Cert Maths-Geometry_Detail.pdf
0953be2a-ed00-44ab-b44c-28f362269a6a,equal length of perpendiculars from angle bisector,Perpendiculars dropped from any point on an angle bisector to the arms of the angle have equal length.,angle bisector properties,Geometry,6_Leaving Cert Maths-Geometry_Detail.pdf
023a0c93-2d23-4225-bf6a-2d057e95cf85,area of a triangle,Half the product of a chosen base length and its corresponding height.,area,Geometry,6_Leaving Cert Maths-Geometry_Detail.pdf
d6b49869-f8a2-4cec-91c1-eee79bb54bbe,additivity of area for triangles,The area of a triangle divided by a segment is the sum of the areas of the two smaller triangles formed.,area,Geometry,6_Leaving Cert Maths-Geometry_Detail.pdf
0bd9368c-6be7-4f1d-bd6c-291544be7133,area of rectangle,The product of the lengths of its two adjacent sides.,area,Geometry,6_Leaving Cert Maths-Geometry_Detail.pdf
b396b834-a72f-4dbf-8daa-0c47cf33b2a6,area of parallelogram,The product of the base length and the corresponding height.,area,Geometry,6_Leaving Cert Maths-Geometry_Detail.pdf
1890a689-c47e-4d5d-a061-fb530e786a51,circle and its components,"A set of points equidistant (radius) from a fixed point (center), including chords, diameter (twice radius), arcs, sectors, circumference, and disc (interior).",circle properties,Geometry,6_Leaving Cert Maths-Geometry_Detail.pdf
f2810369-e498-4d49-a55c-28ae3127987f,angle at center and angle at circumference,The angle at the center standing on an arc is twice the angle at any point on the circumference standing on the same arc.,circle angle properties,Geometry,6_Leaving Cert Maths-Geometry_Detail.pdf
71c9e006-fe1e-4c55-9585-2247e9bd9978,angles standing on the same arc are equal,All angles at points on the circle standing on the same arc are equal in measure.,circle angle properties,Geometry,6_Leaving Cert Maths-Geometry_Detail.pdf
25add95a-d981-46b8-b762-063154393c24,angle in a semicircle,An angle standing on a diameter arc is a right angle (90 degrees).,circle angle properties,Geometry,6_Leaving Cert Maths-Geometry_Detail.pdf
b2705b71-2914-4eb1-a87b-92b8c3b99e59,cyclic quadrilateral,A quadrilateral whose vertices all lie on a single circle.,circle properties,Geometry,6_Leaving Cert Maths-Geometry_Detail.pdf
7c4f56a4-13f0-4ca6-b29b-58bbf7acbd6a,opposite angles of cyclic quadrilateral sum to 180 degrees,"In a cyclic quadrilateral, each pair of opposite angles adds up to 180 degrees.",circle properties,Geometry,6_Leaving Cert Maths-Geometry_Detail.pdf
f494cd75-c750-4a5e-98bc-e31104b70e11,line tangent to a circle,"A line that touches a circle at exactly one point, called the point of contact.",circle properties,Geometry,6_Leaving Cert Maths-Geometry_Detail.pdf
56bd00bc-148e-4e7b-814a-cd550be0dc1e,tangent perpendicular to radius,A tangent line to a circle is perpendicular to the radius drawn to the point of contact.,circle properties,Geometry,6_Leaving Cert Maths-Geometry_Detail.pdf
